{
  "address": "0x537999fC69E73089B198738af97F286A3Dae3e34",
  "abi": [
    {
      "inputs": [
        {
          "internalType": "address",
          "name": "manager",
          "type": "address"
        },
        {
          "internalType": "contract ICollateralJoin",
          "name": "collateralJoin",
          "type": "address"
        },
        {
          "internalType": "uint256",
          "name": "cdp",
          "type": "uint256"
        },
        {
          "internalType": "uint256",
          "name": "amt",
          "type": "uint256"
        }
      ],
      "name": "exitTokenCollateral",
      "outputs": [],
      "stateMutability": "nonpayable",
      "type": "function"
    },
    {
      "inputs": [
        {
          "internalType": "address",
          "name": "manager",
          "type": "address"
        },
        {
          "internalType": "contract ICollateralJoin",
          "name": "collateralJoin",
          "type": "address"
        },
        {
          "internalType": "uint256",
          "name": "cdp",
          "type": "uint256"
        },
        {
          "internalType": "uint256",
          "name": "amt",
          "type": "uint256"
        }
      ],
      "name": "freeTokenCollateral",
      "outputs": [],
      "stateMutability": "nonpayable",
      "type": "function"
    },
    {
      "inputs": [
        {
          "internalType": "address",
          "name": "manager",
          "type": "address"
        },
        {
          "internalType": "address",
          "name": "taxCollector",
          "type": "address"
        },
        {
          "internalType": "address",
          "name": "coinJoin",
          "type": "address"
        },
        {
          "internalType": "uint256",
          "name": "cdp",
          "type": "uint256"
        },
        {
          "internalType": "uint256",
          "name": "wad",
          "type": "uint256"
        },
        {
          "internalType": "uint256",
          "name": "lockupPeriod",
          "type": "uint256"
        }
      ],
      "name": "generateDebt",
      "outputs": [],
      "stateMutability": "nonpayable",
      "type": "function"
    },
    {
      "inputs": [
        {
          "internalType": "address",
          "name": "manager",
          "type": "address"
        },
        {
          "internalType": "address",
          "name": "user",
          "type": "address"
        },
        {
          "internalType": "bytes32",
          "name": "collateralType",
          "type": "bytes32"
        }
      ],
      "name": "getAvailableToBorrow",
      "outputs": [
        {
          "internalType": "uint256",
          "name": "",
          "type": "uint256"
        }
      ],
      "stateMutability": "view",
      "type": "function"
    },
    {
      "inputs": [
        {
          "internalType": "address",
          "name": "manager",
          "type": "address"
        },
        {
          "internalType": "address",
          "name": "user",
          "type": "address"
        },
        {
          "internalType": "bytes32",
          "name": "collateralType",
          "type": "bytes32"
        }
      ],
      "name": "getAvailableToWithdraw",
      "outputs": [
        {
          "internalType": "uint256",
          "name": "",
          "type": "uint256"
        }
      ],
      "stateMutability": "view",
      "type": "function"
    },
    {
      "inputs": [
        {
          "internalType": "address",
          "name": "manager",
          "type": "address"
        },
        {
          "internalType": "address",
          "name": "user",
          "type": "address"
        },
        {
          "internalType": "bytes32",
          "name": "collateralType",
          "type": "bytes32"
        }
      ],
      "name": "getCdpId",
      "outputs": [
        {
          "internalType": "uint256",
          "name": "",
          "type": "uint256"
        }
      ],
      "stateMutability": "view",
      "type": "function"
    },
    {
      "inputs": [
        {
          "internalType": "address",
          "name": "manager",
          "type": "address"
        },
        {
          "internalType": "address",
          "name": "user",
          "type": "address"
        },
        {
          "internalType": "bytes32",
          "name": "collateralType",
          "type": "bytes32"
        }
      ],
      "name": "getCdpInfo",
      "outputs": [
        {
          "internalType": "uint256",
          "name": "",
          "type": "uint256"
        },
        {
          "internalType": "uint256",
          "name": "",
          "type": "uint256"
        }
      ],
      "stateMutability": "view",
      "type": "function"
    },
    {
      "inputs": [
        {
          "internalType": "address",
          "name": "manager",
          "type": "address"
        },
        {
          "internalType": "contract ICollateralJoin",
          "name": "collateralJoin",
          "type": "address"
        },
        {
          "internalType": "uint256",
          "name": "cdp",
          "type": "uint256"
        },
        {
          "internalType": "uint256",
          "name": "amt",
          "type": "uint256"
        }
      ],
      "name": "lockTokenCollateral",
      "outputs": [],
      "stateMutability": "nonpayable",
      "type": "function"
    },
    {
      "inputs": [
        {
          "internalType": "address",
          "name": "manager",
          "type": "address"
        },
        {
          "internalType": "address",
          "name": "taxCollector",
          "type": "address"
        },
        {
          "internalType": "contract ICollateralJoin",
          "name": "collateralJoin",
          "type": "address"
        },
        {
          "internalType": "address",
          "name": "coinJoin",
          "type": "address"
        },
        {
          "internalType": "uint256",
          "name": "cdp",
          "type": "uint256"
        },
        {
          "internalType": "uint256",
          "name": "collateralAmount",
          "type": "uint256"
        },
        {
          "internalType": "uint256",
          "name": "deltaWad",
          "type": "uint256"
        },
        {
          "internalType": "uint256",
          "name": "lockupPeriod",
          "type": "uint256"
        }
      ],
      "name": "lockTokenCollateralAndGenerateDebt",
      "outputs": [],
      "stateMutability": "nonpayable",
      "type": "function"
    },
    {
      "inputs": [
        {
          "internalType": "address",
          "name": "manager",
          "type": "address"
        },
        {
          "internalType": "address",
          "name": "taxCollector",
          "type": "address"
        },
        {
          "internalType": "contract ICollateralJoin",
          "name": "collateralJoin",
          "type": "address"
        },
        {
          "internalType": "address",
          "name": "coinJoin",
          "type": "address"
        },
        {
          "internalType": "bytes32",
          "name": "collateralType",
          "type": "bytes32"
        },
        {
          "internalType": "uint256",
          "name": "amtC",
          "type": "uint256"
        },
        {
          "internalType": "uint256",
          "name": "wadD",
          "type": "uint256"
        },
        {
          "internalType": "uint256",
          "name": "lockupPeriod",
          "type": "uint256"
        }
      ],
      "name": "openLockTokenCollateralAndGenerateDebt",
      "outputs": [
        {
          "internalType": "uint256",
          "name": "cdp",
          "type": "uint256"
        }
      ],
      "stateMutability": "nonpayable",
      "type": "function"
    },
    {
      "inputs": [
        {
          "internalType": "address",
          "name": "manager",
          "type": "address"
        },
        {
          "internalType": "address",
          "name": "coinJoin",
          "type": "address"
        },
        {
          "internalType": "uint256",
          "name": "cdp",
          "type": "uint256"
        }
      ],
      "name": "repayAllDebt",
      "outputs": [],
      "stateMutability": "nonpayable",
      "type": "function"
    },
    {
      "inputs": [
        {
          "internalType": "address",
          "name": "manager",
          "type": "address"
        },
        {
          "internalType": "contract ICollateralJoin",
          "name": "collateralJoin",
          "type": "address"
        },
        {
          "internalType": "address",
          "name": "coinJoin",
          "type": "address"
        },
        {
          "internalType": "uint256",
          "name": "cdp",
          "type": "uint256"
        },
        {
          "internalType": "uint256",
          "name": "amtC",
          "type": "uint256"
        }
      ],
      "name": "repayAllDebtAndFreeTokenCollateral",
      "outputs": [],
      "stateMutability": "nonpayable",
      "type": "function"
    },
    {
      "inputs": [
        {
          "internalType": "address",
          "name": "manager",
          "type": "address"
        },
        {
          "internalType": "address",
          "name": "coinJoin",
          "type": "address"
        },
        {
          "internalType": "uint256",
          "name": "cdp",
          "type": "uint256"
        },
        {
          "internalType": "uint256",
          "name": "wad",
          "type": "uint256"
        }
      ],
      "name": "repayDebt",
      "outputs": [],
      "stateMutability": "nonpayable",
      "type": "function"
    },
    {
      "inputs": [
        {
          "internalType": "address",
          "name": "manager",
          "type": "address"
        },
        {
          "internalType": "contract ICollateralJoin",
          "name": "collateralJoin",
          "type": "address"
        },
        {
          "internalType": "address",
          "name": "coinJoin",
          "type": "address"
        },
        {
          "internalType": "uint256",
          "name": "cdp",
          "type": "uint256"
        },
        {
          "internalType": "uint256",
          "name": "amtC",
          "type": "uint256"
        },
        {
          "internalType": "uint256",
          "name": "wadD",
          "type": "uint256"
        }
      ],
      "name": "repayDebtAndFreeTokenCollateral",
      "outputs": [],
      "stateMutability": "nonpayable",
      "type": "function"
    }
  ],
  "numDeployments": 1,
  "solcInputHash": "8f84b6f1e4072e92a972e80f9a9e23c6",
  "metadata": "{\"compiler\":{\"version\":\"0.8.17+commit.8df45f5f\"},\"language\":\"Solidity\",\"output\":{\"abi\":[{\"inputs\":[{\"internalType\":\"address\",\"name\":\"manager\",\"type\":\"address\"},{\"internalType\":\"contract ICollateralJoin\",\"name\":\"collateralJoin\",\"type\":\"address\"},{\"internalType\":\"uint256\",\"name\":\"cdp\",\"type\":\"uint256\"},{\"internalType\":\"uint256\",\"name\":\"amt\",\"type\":\"uint256\"}],\"name\":\"exitTokenCollateral\",\"outputs\":[],\"stateMutability\":\"nonpayable\",\"type\":\"function\"},{\"inputs\":[{\"internalType\":\"address\",\"name\":\"manager\",\"type\":\"address\"},{\"internalType\":\"contract ICollateralJoin\",\"name\":\"collateralJoin\",\"type\":\"address\"},{\"internalType\":\"uint256\",\"name\":\"cdp\",\"type\":\"uint256\"},{\"internalType\":\"uint256\",\"name\":\"amt\",\"type\":\"uint256\"}],\"name\":\"freeTokenCollateral\",\"outputs\":[],\"stateMutability\":\"nonpayable\",\"type\":\"function\"},{\"inputs\":[{\"internalType\":\"address\",\"name\":\"manager\",\"type\":\"address\"},{\"internalType\":\"address\",\"name\":\"taxCollector\",\"type\":\"address\"},{\"internalType\":\"address\",\"name\":\"coinJoin\",\"type\":\"address\"},{\"internalType\":\"uint256\",\"name\":\"cdp\",\"type\":\"uint256\"},{\"internalType\":\"uint256\",\"name\":\"wad\",\"type\":\"uint256\"},{\"internalType\":\"uint256\",\"name\":\"lockupPeriod\",\"type\":\"uint256\"}],\"name\":\"generateDebt\",\"outputs\":[],\"stateMutability\":\"nonpayable\",\"type\":\"function\"},{\"inputs\":[{\"internalType\":\"address\",\"name\":\"manager\",\"type\":\"address\"},{\"internalType\":\"address\",\"name\":\"user\",\"type\":\"address\"},{\"internalType\":\"bytes32\",\"name\":\"collateralType\",\"type\":\"bytes32\"}],\"name\":\"getAvailableToBorrow\",\"outputs\":[{\"internalType\":\"uint256\",\"name\":\"\",\"type\":\"uint256\"}],\"stateMutability\":\"view\",\"type\":\"function\"},{\"inputs\":[{\"internalType\":\"address\",\"name\":\"manager\",\"type\":\"address\"},{\"internalType\":\"address\",\"name\":\"user\",\"type\":\"address\"},{\"internalType\":\"bytes32\",\"name\":\"collateralType\",\"type\":\"bytes32\"}],\"name\":\"getAvailableToWithdraw\",\"outputs\":[{\"internalType\":\"uint256\",\"name\":\"\",\"type\":\"uint256\"}],\"stateMutability\":\"view\",\"type\":\"function\"},{\"inputs\":[{\"internalType\":\"address\",\"name\":\"manager\",\"type\":\"address\"},{\"internalType\":\"address\",\"name\":\"user\",\"type\":\"address\"},{\"internalType\":\"bytes32\",\"name\":\"collateralType\",\"type\":\"bytes32\"}],\"name\":\"getCdpId\",\"outputs\":[{\"internalType\":\"uint256\",\"name\":\"\",\"type\":\"uint256\"}],\"stateMutability\":\"view\",\"type\":\"function\"},{\"inputs\":[{\"internalType\":\"address\",\"name\":\"manager\",\"type\":\"address\"},{\"internalType\":\"address\",\"name\":\"user\",\"type\":\"address\"},{\"internalType\":\"bytes32\",\"name\":\"collateralType\",\"type\":\"bytes32\"}],\"name\":\"getCdpInfo\",\"outputs\":[{\"internalType\":\"uint256\",\"name\":\"\",\"type\":\"uint256\"},{\"internalType\":\"uint256\",\"name\":\"\",\"type\":\"uint256\"}],\"stateMutability\":\"view\",\"type\":\"function\"},{\"inputs\":[{\"internalType\":\"address\",\"name\":\"manager\",\"type\":\"address\"},{\"internalType\":\"contract ICollateralJoin\",\"name\":\"collateralJoin\",\"type\":\"address\"},{\"internalType\":\"uint256\",\"name\":\"cdp\",\"type\":\"uint256\"},{\"internalType\":\"uint256\",\"name\":\"amt\",\"type\":\"uint256\"}],\"name\":\"lockTokenCollateral\",\"outputs\":[],\"stateMutability\":\"nonpayable\",\"type\":\"function\"},{\"inputs\":[{\"internalType\":\"address\",\"name\":\"manager\",\"type\":\"address\"},{\"internalType\":\"address\",\"name\":\"taxCollector\",\"type\":\"address\"},{\"internalType\":\"contract ICollateralJoin\",\"name\":\"collateralJoin\",\"type\":\"address\"},{\"internalType\":\"address\",\"name\":\"coinJoin\",\"type\":\"address\"},{\"internalType\":\"uint256\",\"name\":\"cdp\",\"type\":\"uint256\"},{\"internalType\":\"uint256\",\"name\":\"collateralAmount\",\"type\":\"uint256\"},{\"internalType\":\"uint256\",\"name\":\"deltaWad\",\"type\":\"uint256\"},{\"internalType\":\"uint256\",\"name\":\"lockupPeriod\",\"type\":\"uint256\"}],\"name\":\"lockTokenCollateralAndGenerateDebt\",\"outputs\":[],\"stateMutability\":\"nonpayable\",\"type\":\"function\"},{\"inputs\":[{\"internalType\":\"address\",\"name\":\"manager\",\"type\":\"address\"},{\"internalType\":\"address\",\"name\":\"taxCollector\",\"type\":\"address\"},{\"internalType\":\"contract ICollateralJoin\",\"name\":\"collateralJoin\",\"type\":\"address\"},{\"internalType\":\"address\",\"name\":\"coinJoin\",\"type\":\"address\"},{\"internalType\":\"bytes32\",\"name\":\"collateralType\",\"type\":\"bytes32\"},{\"internalType\":\"uint256\",\"name\":\"amtC\",\"type\":\"uint256\"},{\"internalType\":\"uint256\",\"name\":\"wadD\",\"type\":\"uint256\"},{\"internalType\":\"uint256\",\"name\":\"lockupPeriod\",\"type\":\"uint256\"}],\"name\":\"openLockTokenCollateralAndGenerateDebt\",\"outputs\":[{\"internalType\":\"uint256\",\"name\":\"cdp\",\"type\":\"uint256\"}],\"stateMutability\":\"nonpayable\",\"type\":\"function\"},{\"inputs\":[{\"internalType\":\"address\",\"name\":\"manager\",\"type\":\"address\"},{\"internalType\":\"address\",\"name\":\"coinJoin\",\"type\":\"address\"},{\"internalType\":\"uint256\",\"name\":\"cdp\",\"type\":\"uint256\"}],\"name\":\"repayAllDebt\",\"outputs\":[],\"stateMutability\":\"nonpayable\",\"type\":\"function\"},{\"inputs\":[{\"internalType\":\"address\",\"name\":\"manager\",\"type\":\"address\"},{\"internalType\":\"contract ICollateralJoin\",\"name\":\"collateralJoin\",\"type\":\"address\"},{\"internalType\":\"address\",\"name\":\"coinJoin\",\"type\":\"address\"},{\"internalType\":\"uint256\",\"name\":\"cdp\",\"type\":\"uint256\"},{\"internalType\":\"uint256\",\"name\":\"amtC\",\"type\":\"uint256\"}],\"name\":\"repayAllDebtAndFreeTokenCollateral\",\"outputs\":[],\"stateMutability\":\"nonpayable\",\"type\":\"function\"},{\"inputs\":[{\"internalType\":\"address\",\"name\":\"manager\",\"type\":\"address\"},{\"internalType\":\"address\",\"name\":\"coinJoin\",\"type\":\"address\"},{\"internalType\":\"uint256\",\"name\":\"cdp\",\"type\":\"uint256\"},{\"internalType\":\"uint256\",\"name\":\"wad\",\"type\":\"uint256\"}],\"name\":\"repayDebt\",\"outputs\":[],\"stateMutability\":\"nonpayable\",\"type\":\"function\"},{\"inputs\":[{\"internalType\":\"address\",\"name\":\"manager\",\"type\":\"address\"},{\"internalType\":\"contract ICollateralJoin\",\"name\":\"collateralJoin\",\"type\":\"address\"},{\"internalType\":\"address\",\"name\":\"coinJoin\",\"type\":\"address\"},{\"internalType\":\"uint256\",\"name\":\"cdp\",\"type\":\"uint256\"},{\"internalType\":\"uint256\",\"name\":\"amtC\",\"type\":\"uint256\"},{\"internalType\":\"uint256\",\"name\":\"wadD\",\"type\":\"uint256\"}],\"name\":\"repayDebtAndFreeTokenCollateral\",\"outputs\":[],\"stateMutability\":\"nonpayable\",\"type\":\"function\"}],\"devdoc\":{\"custom:changes\":\"Removed functions from MakerDAO\\u2019s version (e.g., ETH/GNT support, some Safe management) to reduce deployment size.                 Replaced `vat` with `safeEngine` and updated to StableUnit-specific interfaces.\",\"custom:security\":\"This contract is stateless and relies on DSProxy for access control. Users must approve token transfers                 to the proxy for operations like locking collateral or repaying debt. The SafeEngine enforces collateralization                 and debt limits. Some functions assume collateral tokens have arbitrary decimals, handled via `convertTo18`.\",\"custom:usage\":\"- **Deployment**: Deploy as a stateless contract for DSProxy use.   ```solidity   DssProxyActions proxyActions = new DssProxyActions();   ``` - **Lock Collateral**: Deposit collateral into a Safe.   ```solidity   proxyActions.lockTokenCollateral(cdpManager, collateralJoin, cdpId, amount);   ``` - **Generate Debt**: Draw StablePro debt from a Safe.   ```solidity   proxyActions.generateDebt(cdpManager, taxCollector, coinJoin, cdpId, amount, lockupPeriod);   ``` - **Repay Debt**: Repay StablePro debt to a Safe.   ```solidity   proxyActions.repayDebt(cdpManager, coinJoin, cdpId, amount);   ``` - **Combined Operations**: Lock collateral and generate debt in one transaction.   ```solidity   proxyActions.lockTokenCollateralAndGenerateDebt(cdpManager, taxCollector, collateralJoin, coinJoin, cdpId, collateralAmount, debtAmount, lockupPeriod);   ``` - **Query Safe Info**: Retrieve Safe details for UI display.   ```solidity   (uint256 lockedCollateral, uint256 generatedDebt) = proxyActions.getCdpInfo(cdpManager, user, collateralType);   ```\",\"custom:warning\":\"Functions are intended for DSProxy use; direct calls may be unsafe due to lack of access control.\",\"details\":\"Provides functions to manage collateralized debt positions (Safes) through a user\\u2019s proxy, including      locking/unlocking collateral, generating/repaying debt, and querying Safe information. It interacts with      StableUnit contracts like DssCdpManager, SafeEngine, CollateralJoin, CoinJoin, and TaxCollector. This contract      is designed to be called via a DSProxy, reducing complexity for users, and includes view functions for UI integration.      Some functions were removed from the MakerDAO version to optimize deployment size.\",\"kind\":\"dev\",\"methods\":{\"exitTokenCollateral(address,address,uint256,uint256)\":{\"details\":\"Transfers collateral from the Safe to the proxy and withdraws tokens via CollateralJoin.\",\"params\":{\"amt\":\"Amount of collateral to withdraw [in token\\u2019s decimal precision].\",\"cdp\":\"Unique identifier of the Safe.\",\"collateralJoin\":\"Address of the CollateralJoin contract.\",\"manager\":\"Address of the DssCdpManager contract.\"}},\"freeTokenCollateral(address,address,uint256,uint256)\":{\"details\":\"Reduces the Safe\\u2019s collateral balance and withdraws tokens via CollateralJoin.\",\"params\":{\"amt\":\"Amount of collateral to unlock [in token\\u2019s decimal precision].\",\"cdp\":\"Unique identifier of the Safe.\",\"collateralJoin\":\"Address of the CollateralJoin contract.\",\"manager\":\"Address of the DssCdpManager contract.\"}},\"generateDebt(address,address,address,uint256,uint256,uint256)\":{\"details\":\"Increases Safe debt, transfers StablePro to the proxy, and withdraws tokens via CoinJoin.\",\"params\":{\"cdp\":\"Unique identifier of the Safe.\",\"coinJoin\":\"Address of the CoinJoin contract.\",\"lockupPeriod\":\"Lockup period for the generated StablePro (protocol-specific).\",\"manager\":\"Address of the DssCdpManager contract.\",\"taxCollector\":\"Address of the TaxCollector contract.\",\"wad\":\"Amount of StablePro to generate [wad].\"}},\"getAvailableToBorrow(address,address,bytes32)\":{\"details\":\"Determines borrowing capacity based on collateral value, debt limits, and safety price.\",\"params\":{\"collateralType\":\"Unique identifier for the collateral type.\",\"manager\":\"Address of the DssCdpManager contract.\",\"user\":\"Address of the Safe owner.\"},\"returns\":{\"_0\":\"Amount of StablePro available to borrow [wad].\"}},\"getAvailableToWithdraw(address,address,bytes32)\":{\"details\":\"Determines excess collateral based on the Safe\\u2019s collateralization ratio and safety price.\",\"params\":{\"collateralType\":\"Unique identifier for the collateral type.\",\"manager\":\"Address of the DssCdpManager contract.\",\"user\":\"Address of the Safe owner.\"},\"returns\":{\"_0\":\"Amount of collateral available to withdraw [wad].\"}},\"getCdpId(address,address,bytes32)\":{\"details\":\"Iterates through the user\\u2019s Safes in DssCdpManager to find the matching collateral type.\",\"params\":{\"collateralType\":\"Unique identifier for the collateral type.\",\"manager\":\"Address of the DssCdpManager contract.\",\"user\":\"Address of the Safe owner.\"},\"returns\":{\"_0\":\"cdpId Unique identifier of the Safe, or type(uint256).max if not found.\"}},\"getCdpInfo(address,address,bytes32)\":{\"details\":\"Queries SafeEngine for the Safe\\u2019s locked collateral and generated debt.\",\"params\":{\"collateralType\":\"Unique identifier for the collateral type.\",\"manager\":\"Address of the DssCdpManager contract.\",\"user\":\"Address of the Safe owner.\"},\"returns\":{\"_0\":\"lockedCollateral Amount of locked collateral [wad].\",\"_1\":\"generatedDebt Amount of generated debt [wad].\"}},\"lockTokenCollateral(address,address,uint256,uint256)\":{\"details\":\"Deposits collateral via CollateralJoin and updates the Safe\\u2019s collateral balance.\",\"params\":{\"amt\":\"Amount of collateral to lock [in token\\u2019s decimal precision].\",\"cdp\":\"Unique identifier of the Safe.\",\"collateralJoin\":\"Address of the CollateralJoin contract.\",\"manager\":\"Address of the DssCdpManager contract.\"}},\"lockTokenCollateralAndGenerateDebt(address,address,address,address,uint256,uint256,uint256,uint256)\":{\"details\":\"Combines collateral deposit and debt generation for efficiency.\",\"params\":{\"cdp\":\"Unique identifier of the Safe.\",\"coinJoin\":\"Address of the CoinJoin contract.\",\"collateralAmount\":\"Amount of collateral to lock [in token\\u2019s decimal precision].\",\"collateralJoin\":\"Address of the CollateralJoin contract.\",\"deltaWad\":\"Amount of StablePro debt to generate [wad].\",\"lockupPeriod\":\"Lockup period for the generated StablePro (protocol-specific).\",\"manager\":\"Address of the DssCdpManager contract.\",\"taxCollector\":\"Address of the TaxCollector contract.\"}},\"openLockTokenCollateralAndGenerateDebt(address,address,address,address,bytes32,uint256,uint256,uint256)\":{\"details\":\"Combines Safe creation, collateral deposit, and debt generation for efficiency.\",\"params\":{\"amtC\":\"Amount of collateral to lock [in token\\u2019s decimal precision].\",\"coinJoin\":\"Address of the CoinJoin contract.\",\"collateralJoin\":\"Address of the CollateralJoin contract.\",\"collateralType\":\"Unique identifier for the collateral type.\",\"lockupPeriod\":\"Lockup period for the generated StablePro (protocol-specific).\",\"manager\":\"Address of the DssCdpManager contract.\",\"taxCollector\":\"Address of the TaxCollector contract.\",\"wadD\":\"Amount of StablePro debt to generate [wad].\"},\"returns\":{\"cdp\":\"Unique identifier of the newly created Safe.\"}},\"repayAllDebt(address,address,uint256)\":{\"details\":\"Deposits the required StablePro via CoinJoin and clears all Safe debt, handling ownership or permissions.\",\"params\":{\"cdp\":\"Unique identifier of the Safe.\",\"coinJoin\":\"Address of the CoinJoin contract.\",\"manager\":\"Address of the DssCdpManager contract.\"}},\"repayAllDebtAndFreeTokenCollateral(address,address,address,uint256,uint256)\":{\"details\":\"Combines full debt repayment and collateral withdrawal for efficiency.\",\"params\":{\"amtC\":\"Amount of collateral to unlock [in token\\u2019s decimal precision].\",\"cdp\":\"Unique identifier of the Safe.\",\"coinJoin\":\"Address of the CoinJoin contract.\",\"collateralJoin\":\"Address of the CollateralJoin contract.\",\"manager\":\"Address of the DssCdpManager contract.\"}},\"repayDebt(address,address,uint256,uint256)\":{\"details\":\"Deposits StablePro via CoinJoin and reduces Safe debt, handling ownership or permissions.\",\"params\":{\"cdp\":\"Unique identifier of the Safe.\",\"coinJoin\":\"Address of the CoinJoin contract.\",\"manager\":\"Address of the DssCdpManager contract.\",\"wad\":\"Amount of StablePro to repay [wad].\"}},\"repayDebtAndFreeTokenCollateral(address,address,address,uint256,uint256,uint256)\":{\"details\":\"Combines debt repayment and collateral withdrawal for efficiency.\",\"params\":{\"amtC\":\"Amount of collateral to unlock [in token\\u2019s decimal precision].\",\"cdp\":\"Unique identifier of the Safe.\",\"coinJoin\":\"Address of the CoinJoin contract.\",\"collateralJoin\":\"Address of the CollateralJoin contract.\",\"manager\":\"Address of the DssCdpManager contract.\",\"wadD\":\"Amount of StablePro to repay [wad].\"}}},\"title\":\"DssProxyActions\",\"version\":1},\"userdoc\":{\"kind\":\"user\",\"methods\":{\"exitTokenCollateral(address,address,uint256,uint256)\":{\"notice\":\"Withdraws collateral from a Safe to the caller.\"},\"freeTokenCollateral(address,address,uint256,uint256)\":{\"notice\":\"Unlocks collateral from a Safe and withdraws it to the caller.\"},\"generateDebt(address,address,address,uint256,uint256,uint256)\":{\"notice\":\"Generates StablePro debt from a Safe.\"},\"getAvailableToBorrow(address,address,bytes32)\":{\"notice\":\"Calculates the amount of StablePro a user can borrow from a Safe.\"},\"getAvailableToWithdraw(address,address,bytes32)\":{\"notice\":\"Calculates the amount of collateral a user can withdraw from a Safe.\"},\"getCdpId(address,address,bytes32)\":{\"notice\":\"Retrieves the Safe ID for a user\\u2019s Safe with a specific collateral type.\"},\"getCdpInfo(address,address,bytes32)\":{\"notice\":\"Retrieves collateral and debt information for a user\\u2019s Safe.\"},\"lockTokenCollateral(address,address,uint256,uint256)\":{\"notice\":\"Locks collateral into a Safe.\"},\"lockTokenCollateralAndGenerateDebt(address,address,address,address,uint256,uint256,uint256,uint256)\":{\"notice\":\"Locks collateral and generates StablePro debt in a single transaction.\"},\"openLockTokenCollateralAndGenerateDebt(address,address,address,address,bytes32,uint256,uint256,uint256)\":{\"notice\":\"Opens a Safe, locks collateral, and generates StablePro debt in a single transaction.\"},\"repayAllDebt(address,address,uint256)\":{\"notice\":\"Repays all StablePro debt for a Safe.\"},\"repayAllDebtAndFreeTokenCollateral(address,address,address,uint256,uint256)\":{\"notice\":\"Repays all StablePro debt and unlocks collateral from a Safe in a single transaction.\"},\"repayDebt(address,address,uint256,uint256)\":{\"notice\":\"Repays StablePro debt to a Safe.\"},\"repayDebtAndFreeTokenCollateral(address,address,address,uint256,uint256,uint256)\":{\"notice\":\"Repays StablePro debt and unlocks collateral from a Safe in a single transaction.\"}},\"notice\":\"Proxy actions contract for user interaction with the StableUnit protocol via a DSProxy.\",\"version\":1}},\"settings\":{\"compilationTarget\":{\"contracts/makerdao/externalContracts/DssProxyActions.sol\":\"DssProxyActions\"},\"evmVersion\":\"london\",\"libraries\":{},\"metadata\":{\"bytecodeHash\":\"none\",\"useLiteralContent\":true},\"optimizer\":{\"enabled\":true,\"runs\":1},\"remappings\":[]},\"sources\":{\"@openzeppelin/contracts/token/ERC20/IERC20.sol\":{\"content\":\"// SPDX-License-Identifier: MIT\\n// OpenZeppelin Contracts (last updated v4.9.0) (token/ERC20/IERC20.sol)\\n\\npragma solidity ^0.8.0;\\n\\n/**\\n * @dev Interface of the ERC20 standard as defined in the EIP.\\n */\\ninterface IERC20 {\\n    /**\\n     * @dev Emitted when `value` tokens are moved from one account (`from`) to\\n     * another (`to`).\\n     *\\n     * Note that `value` may be zero.\\n     */\\n    event Transfer(address indexed from, address indexed to, uint256 value);\\n\\n    /**\\n     * @dev Emitted when the allowance of a `spender` for an `owner` is set by\\n     * a call to {approve}. `value` is the new allowance.\\n     */\\n    event Approval(address indexed owner, address indexed spender, uint256 value);\\n\\n    /**\\n     * @dev Returns the amount of tokens in existence.\\n     */\\n    function totalSupply() external view returns (uint256);\\n\\n    /**\\n     * @dev Returns the amount of tokens owned by `account`.\\n     */\\n    function balanceOf(address account) external view returns (uint256);\\n\\n    /**\\n     * @dev Moves `amount` tokens from the caller's account to `to`.\\n     *\\n     * Returns a boolean value indicating whether the operation succeeded.\\n     *\\n     * Emits a {Transfer} event.\\n     */\\n    function transfer(address to, uint256 amount) external returns (bool);\\n\\n    /**\\n     * @dev Returns the remaining number of tokens that `spender` will be\\n     * allowed to spend on behalf of `owner` through {transferFrom}. This is\\n     * zero by default.\\n     *\\n     * This value changes when {approve} or {transferFrom} are called.\\n     */\\n    function allowance(address owner, address spender) external view returns (uint256);\\n\\n    /**\\n     * @dev Sets `amount` as the allowance of `spender` over the caller's tokens.\\n     *\\n     * Returns a boolean value indicating whether the operation succeeded.\\n     *\\n     * IMPORTANT: Beware that changing an allowance with this method brings the risk\\n     * that someone may use both the old and the new allowance by unfortunate\\n     * transaction ordering. One possible solution to mitigate this race\\n     * condition is to first reduce the spender's allowance to 0 and set the\\n     * desired value afterwards:\\n     * https://github.com/ethereum/EIPs/issues/20#issuecomment-263524729\\n     *\\n     * Emits an {Approval} event.\\n     */\\n    function approve(address spender, uint256 amount) external returns (bool);\\n\\n    /**\\n     * @dev Moves `amount` tokens from `from` to `to` using the\\n     * allowance mechanism. `amount` is then deducted from the caller's\\n     * allowance.\\n     *\\n     * Returns a boolean value indicating whether the operation succeeded.\\n     *\\n     * Emits a {Transfer} event.\\n     */\\n    function transferFrom(address from, address to, uint256 amount) external returns (bool);\\n}\\n\",\"keccak256\":\"0x287b55befed2961a7eabd7d7b1b2839cbca8a5b80ef8dcbb25ed3d4c2002c305\",\"license\":\"MIT\"},\"@openzeppelin/contracts/token/ERC20/extensions/IERC20Metadata.sol\":{\"content\":\"// SPDX-License-Identifier: MIT\\n// OpenZeppelin Contracts v4.4.1 (token/ERC20/extensions/IERC20Metadata.sol)\\n\\npragma solidity ^0.8.0;\\n\\nimport \\\"../IERC20.sol\\\";\\n\\n/**\\n * @dev Interface for the optional metadata functions from the ERC20 standard.\\n *\\n * _Available since v4.1._\\n */\\ninterface IERC20Metadata is IERC20 {\\n    /**\\n     * @dev Returns the name of the token.\\n     */\\n    function name() external view returns (string memory);\\n\\n    /**\\n     * @dev Returns the symbol of the token.\\n     */\\n    function symbol() external view returns (string memory);\\n\\n    /**\\n     * @dev Returns the decimals places of the token.\\n     */\\n    function decimals() external view returns (uint8);\\n}\\n\",\"keccak256\":\"0x8de418a5503946cabe331f35fe242d3201a73f67f77aaeb7110acb1f30423aca\",\"license\":\"MIT\"},\"contracts/makerdao/externalContracts/DssProxyActions.sol\":{\"content\":\"// SPDX-License-Identifier: AGPL-3.0-or-later\\n\\n/// DssProxyActions.sol\\n\\n// Copyright (C) 2018-2020 Maker Ecosystem Growth Holdings, INC.\\n\\n// This program is free software: you can redistribute it and/or modify\\n// it under the terms of the GNU Affero General Public License as published by\\n// the Free Software Foundation, either version 3 of the License, or\\n// (at your option) any later version.\\n//\\n// This program is distributed in the hope that it will be useful,\\n// but WITHOUT ANY WARRANTY; without even the implied warranty of\\n// MERCHANTABILITY or FITNESS FOR A PARTICULAR PURPOSE.  See the\\n// GNU Affero General Public License for more details.\\n//\\n// You should have received a copy of the GNU Affero General Public License\\n// along with this program.  If not, see <https://www.gnu.org/licenses/>.\\n\\n// CHANGED: removed some functions. As default this contract was too large to deploy. Also\\n\\nimport \\\"../interfaces/ICoinJoin.sol\\\";\\nimport \\\"../interfaces/ICollateralJoin.sol\\\";\\nimport \\\"../interfaces/IDssCdpManager.sol\\\";\\nimport \\\"../interfaces/ITaxCollector.sol\\\";\\nimport \\\"@openzeppelin/contracts/token/ERC20/IERC20.sol\\\";\\n\\npragma solidity ^0.8.0;\\n\\n// !!!!!!!!!!!!!!!!!!!!!!!!!!!!!!!!!!!!!!!!!!!!!!!!!!!!!!!!!!!!!!!!!!!!!!!!!!!!!!!!!!!!!!!!!!!!!!!!!!!!!!!!!!!!!!!!!!\\n// WARNING: These functions meant to be used as a a library for a DSProxy. Some are unsafe if you call them directly.\\n// !!!!!!!!!!!!!!!!!!!!!!!!!!!!!!!!!!!!!!!!!!!!!!!!!!!!!!!!!!!!!!!!!!!!!!!!!!!!!!!!!!!!!!!!!!!!!!!!!!!!!!!!!!!!!!!!!!\\n\\n/**\\n * @title Math\\n * @notice Abstract utility contract for precise arithmetic operations in the StableUnit protocol.\\n * @dev Provides internal functions for multiplication, addition, subtraction, integer conversion, and precision adjustments\\n *      used by DssProxyActions. Supports ray (10^27) and rad (10^45) precision for calculations involving rates and debt.\\n *      This contract is inherited by DssProxyActions to ensure safe arithmetic operations.\\n * @custom:usage\\n * - **Inheritance**: DssProxyActions inherits Math to use its arithmetic functions.\\n *   ```solidity\\n *   contract DssProxyActions is Math { ... }\\n *   ```\\n * - **Multiplication**: Use `mul` for overflow-safe multiplication.\\n *   ```solidity\\n *   uint256 product = mul(a, b); // Safe multiplication\\n *   ```\\n * - **Precision Conversion**: Use `convertTo18` to adjust collateral amounts to 18 decimals.\\n *   ```solidity\\n *   uint256 wad = convertTo18(collateralJoin, amount); // Convert to WAD precision\\n *   ```\\n * @custom:security All functions include overflow/underflow protection to prevent arithmetic errors.\\n */\\nabstract contract Math {\\n    /// @notice Constant for ray precision (10^27), used in rate calculations.\\n    uint256 constant RAY = 10 ** 27;\\n\\n    /**\\n     * @notice Multiplies two unsigned integers, reverting on overflow.\\n     * @dev Ensures the product does not exceed the maximum uint256 value.\\n     * @param x First operand.\\n     * @param y Second operand.\\n     * @return z Product of x and y.\\n     */\\n    function mul(uint x, uint y) internal pure returns (uint z) {\\n        require(y == 0 || (z = x * y) / y == x, \\\"mul-overflow\\\");\\n    }\\n\\n    /**\\n     * @notice Adds two unsigned integers, reverting on overflow.\\n     * @dev Ensures the sum does not exceed the maximum uint256 value.\\n     * @param x First operand.\\n     * @param y Second operand.\\n     * @return z Sum of x and y.\\n     */\\n    function add(uint x, uint y) internal pure returns (uint z) {\\n        require((z = x + y) >= x);\\n    }\\n\\n    /**\\n     * @notice Subtracts two unsigned integers, reverting on underflow.\\n     * @dev Ensures the result is non-negative.\\n     * @param x First operand.\\n     * @param y Second operand.\\n     * @return z Difference of x and y.\\n     */\\n    function sub(uint x, uint y) internal pure returns (uint z) {\\n        require((z = x - y) <= x, \\\"sub-overflow\\\");\\n    }\\n\\n    /**\\n     * @notice Converts an unsigned integer to a signed integer, reverting on negative values.\\n     * @dev Ensures the input is non-negative for safe conversion.\\n     * @param x Unsigned integer to convert.\\n     * @return y Signed integer representation of x.\\n     */\\n    function toInt(uint x) internal pure returns (int y) {\\n        y = int(x);\\n        require(y >= 0, \\\"int-overflow\\\");\\n    }\\n\\n    /**\\n     * @notice Converts a WAD amount to RAD precision.\\n     * @dev Multiplies the input by 10^27 to convert from 18 to 45 decimals.\\n     * @param wad Amount in WAD precision (18 decimals).\\n     * @return rad Amount in RAD precision (45 decimals).\\n     */\\n    function toRad(uint wad) internal pure returns (uint rad) {\\n        rad = mul(wad, 10 ** 27);\\n    }\\n\\n    /**\\n     * @notice Converts a collateral amount to 18-decimal WAD precision.\\n     * @dev Adjusts the amount based on the collateral token\\u2019s decimals for SafeEngine compatibility.\\n     * @param collateralJoin Address of the CollateralJoin contract.\\n     * @param amt Amount in the collateral token\\u2019s decimal precision.\\n     * @return wad Amount in WAD precision (18 decimals).\\n     */\\n    function convertTo18(ICollateralJoin collateralJoin, uint256 amt) internal returns (uint256 wad) {\\n        // Calculate multiplier for decimal conversion\\n        wad = mul(\\n            amt,\\n            10 ** (18 - collateralJoin.decimals())\\n        );\\n    }\\n}\\n\\n/**\\n * @title DssProxyActions\\n * @notice Proxy actions contract for user interaction with the StableUnit protocol via a DSProxy.\\n * @dev Provides functions to manage collateralized debt positions (Safes) through a user\\u2019s proxy, including\\n *      locking/unlocking collateral, generating/repaying debt, and querying Safe information. It interacts with\\n *      StableUnit contracts like DssCdpManager, SafeEngine, CollateralJoin, CoinJoin, and TaxCollector. This contract\\n *      is designed to be called via a DSProxy, reducing complexity for users, and includes view functions for UI integration.\\n *      Some functions were removed from the MakerDAO version to optimize deployment size.\\n * @custom:warning Functions are intended for DSProxy use; direct calls may be unsafe due to lack of access control.\\n * @custom:usage\\n * - **Deployment**: Deploy as a stateless contract for DSProxy use.\\n *   ```solidity\\n *   DssProxyActions proxyActions = new DssProxyActions();\\n *   ```\\n * - **Lock Collateral**: Deposit collateral into a Safe.\\n *   ```solidity\\n *   proxyActions.lockTokenCollateral(cdpManager, collateralJoin, cdpId, amount);\\n *   ```\\n * - **Generate Debt**: Draw StablePro debt from a Safe.\\n *   ```solidity\\n *   proxyActions.generateDebt(cdpManager, taxCollector, coinJoin, cdpId, amount, lockupPeriod);\\n *   ```\\n * - **Repay Debt**: Repay StablePro debt to a Safe.\\n *   ```solidity\\n *   proxyActions.repayDebt(cdpManager, coinJoin, cdpId, amount);\\n *   ```\\n * - **Combined Operations**: Lock collateral and generate debt in one transaction.\\n *   ```solidity\\n *   proxyActions.lockTokenCollateralAndGenerateDebt(cdpManager, taxCollector, collateralJoin, coinJoin, cdpId, collateralAmount, debtAmount, lockupPeriod);\\n *   ```\\n * - **Query Safe Info**: Retrieve Safe details for UI display.\\n *   ```solidity\\n *   (uint256 lockedCollateral, uint256 generatedDebt) = proxyActions.getCdpInfo(cdpManager, user, collateralType);\\n *   ```\\n * @custom:security This contract is stateless and relies on DSProxy for access control. Users must approve token transfers\\n *                 to the proxy for operations like locking collateral or repaying debt. The SafeEngine enforces collateralization\\n *                 and debt limits. Some functions assume collateral tokens have arbitrary decimals, handled via `convertTo18`.\\n * @custom:changes Removed functions from MakerDAO\\u2019s version (e.g., ETH/GNT support, some Safe management) to reduce deployment size.\\n *                 Replaced `vat` with `safeEngine` and updated to StableUnit-specific interfaces.\\n */\\ncontract DssProxyActions is Math {\\n    /**\\n     * @notice Calculates the delta debt required to generate a specified StablePro amount.\\n     * @dev Updates stability fees via TaxCollector and computes the debt needed to cover the StablePro amount.\\n     *      Accounts for existing Safe balance and rate precision.\\n     * @param safeEngine Address of the SafeEngine contract.\\n     * @param taxCollector Address of the TaxCollector contract.\\n     * @param safe Address of the Safe.\\n     * @param collateralType Unique identifier for the collateral type.\\n     * @param wad Amount of StablePro to generate [wad].\\n     * @return deltaDebt Debt adjustment required [in SafeEngine\\u2019s debt precision].\\n     */\\n    function _getGeneratedDeltaDebt(\\n        ISafeEngine safeEngine,\\n        address taxCollector,\\n        address safe,\\n        bytes32 collateralType,\\n        uint wad\\n    ) internal returns (int deltaDebt) {\\n        // Update stability fee rate\\n        uint rate = ITaxCollector(taxCollector).taxSingle(collateralType);\\n        // Get StablePro balance in SafeEngine\\n        uint stableProBalance = safeEngine.coinBalance(safe);\\n\\n        // Calculate additional debt if balance is insufficient\\n        if (stableProBalance < mul(wad, RAY)) {\\n            deltaDebt = toInt(sub(mul(wad, RAY), stableProBalance) / rate);\\n            // Adjust for precision loss\\n            deltaDebt = mul(uint(deltaDebt), rate) < mul(wad, RAY) ? deltaDebt + 1 : deltaDebt;\\n        }\\n    }\\n\\n    /**\\n     * @notice Calculates the delta debt to repay a specified StablePro amount.\\n     * @dev Determines the debt reduction based on the StablePro amount and Safe\\u2019s debt, respecting rate precision.\\n     * @param safeEngine Address of the SafeEngine contract.\\n     * @param stablePro Amount of StablePro to repay [rad].\\n     * @param safe Address of the Safe.\\n     * @param collateralType Unique identifier for the collateral type.\\n     * @return deltaDebt Debt adjustment to reduce [in SafeEngine\\u2019s debt precision].\\n     */\\n    function _getRepaidDeltaDebt(\\n        ISafeEngine safeEngine,\\n        uint stablePro,\\n        address safe,\\n        bytes32 collateralType\\n    ) internal view returns (int deltaDebt) {\\n        // Get collateral type rate\\n        (, uint rate,,,,,,) = safeEngine.collateralTypes(collateralType);\\n        // Get Safe\\u2019s debt\\n        (, uint safeDebt) = safeEngine.safes(collateralType, safe);\\n\\n        // Calculate debt reduction\\n        deltaDebt = toInt(stablePro / rate);\\n        // Limit to Safe\\u2019s total debt\\n        deltaDebt = uint(deltaDebt) <= safeDebt ? -deltaDebt : -toInt(safeDebt);\\n    }\\n\\n    /**\\n     * @notice Calculates the StablePro amount needed to repay all Safe debt.\\n     * @dev Computes the StablePro required to clear the Safe\\u2019s debt, accounting for rate and precision.\\n     * @param safeEngine Address of the SafeEngine contract.\\n     * @param usr Address of the Safe owner.\\n     * @param safe Address of the Safe.\\n     * @param collateralType Unique identifier for the collateral type.\\n     * @return wad Amount of StablePro required [wad].\\n     */\\n    function _getRepaidAllWad(\\n        ISafeEngine safeEngine,\\n        address usr,\\n        address safe,\\n        bytes32 collateralType\\n    ) internal view returns (uint wad) {\\n        // Get collateral type rate\\n        (, uint rate,,,,,,) = safeEngine.collateralTypes(collateralType);\\n        // Get Safe\\u2019s debt\\n        (, uint safeDebt) = safeEngine.safes(collateralType, safe);\\n        // Get StablePro balance\\n        uint stablePro = safeEngine.coinBalance(usr);\\n\\n        // Calculate required StablePro\\n        uint rad = sub(mul(safeDebt, rate), stablePro);\\n        wad = rad / RAY;\\n        // Adjust for precision dust\\n        wad = mul(wad, RAY) < rad ? wad + 1 : wad;\\n    }\\n\\n    /**\\n     * @notice Deposits StablePro into the SafeEngine via CoinJoin.\\n     * @dev Transfers StablePro tokens from the caller, approves CoinJoin, and joins them into the SafeEngine.\\n     * @param collateralType Unique identifier for the collateral type.\\n     * @param apt Address of the CoinJoin contract.\\n     * @param cdp Address to credit the StablePro balance.\\n     * @param wad Amount of StablePro to deposit [wad].\\n     */\\n    function _coinJoin_join(bytes32 collateralType, address apt, address cdp, uint wad) internal {\\n        // Transfer StablePro from caller\\n        ICoinJoin(apt).systemCoin().transferFrom(msg.sender, address(this), wad);\\n        // Approve CoinJoin to spend StablePro\\n        ICoinJoin(apt).systemCoin().approve(address(apt), wad);\\n        // Deposit StablePro into SafeEngine\\n        ICoinJoin(apt).join(collateralType, msg.sender, cdp, wad);\\n    }\\n\\n    /**\\n     * @notice Deposits collateral into the SafeEngine via CollateralJoin.\\n     * @dev Transfers collateral tokens from the caller, approves CollateralJoin, and joins them into the SafeEngine.\\n     * @param apt Address of the CollateralJoin contract.\\n     * @param safe Address to credit the collateral balance.\\n     * @param amt Amount of collateral to deposit [in token\\u2019s decimal precision].\\n     */\\n    function _collateralJoin_join(ICollateralJoin apt, address safe, uint amt) internal {\\n        // Transfer collateral from caller\\n        apt.collateral().transferFrom(msg.sender, address(this), amt);\\n        // Approve CollateralJoin to spend collateral\\n        apt.collateral().approve(address(apt), amt);\\n        // Deposit collateral into SafeEngine\\n        apt.join(safe, amt);\\n    }\\n\\n    /**\\n     * @notice Transfers collateral from a Safe to a destination.\\n     * @dev Calls DssCdpManager to move collateral balance within the SafeEngine.\\n     * @param manager Address of the DssCdpManager contract.\\n     * @param cdp Unique identifier of the Safe.\\n     * @param dst Address to receive the collateral.\\n     * @param wad Amount of collateral to transfer [wad].\\n     */\\n    function transferCollateral(address manager, uint cdp, address dst, uint wad) internal {\\n        IDssCdpManager(manager).transferCollateral(cdp, dst, wad);\\n    }\\n\\n    /**\\n     * @notice Transfers internal StablePro coins from a Safe to a destination.\\n     * @dev Calls DssCdpManager to move coin balance within the SafeEngine.\\n     * @param manager Address of the DssCdpManager contract.\\n     * @param cdp Unique identifier of the Safe.\\n     * @param dst Address to receive the coins.\\n     * @param rad Amount of StablePro to transfer [rad].\\n     */\\n    function transferInternalCoins(address manager, uint cdp, address dst, uint rad) internal {\\n        IDssCdpManager(manager).transferInternalCoins(cdp, dst, rad);\\n    }\\n\\n    /**\\n     * @notice Modifies a Safe\\u2019s collateral and debt.\\n     * @dev Calls DssCdpManager to adjust the Safe\\u2019s collateral and debt in the SafeEngine.\\n     * @param manager Address of the DssCdpManager contract.\\n     * @param cdp Unique identifier of the Safe.\\n     * @param deltaCollateral Amount to add/remove collateral [wad].\\n     * @param deltaDebt Amount to add/remove debt [in SafeEngine\\u2019s debt precision].\\n     */\\n    function modifySAFECollateralization(address manager, uint cdp, int deltaCollateral, int deltaDebt) internal {\\n        IDssCdpManager(manager).modifySAFECollateralization(cdp, deltaCollateral, deltaDebt);\\n    }\\n\\n    /**\\n     * @notice Opens a new Safe for a collateral type.\\n     * @dev Calls DssCdpManager to create a new Safe and returns its ID.\\n     * @param manager Address of the DssCdpManager contract.\\n     * @param collateralType Unique identifier for the collateral type.\\n     * @param usr Address to own the Safe.\\n     * @return cdp Unique identifier of the newly created Safe.\\n     */\\n    function openSafe(address manager, bytes32 collateralType, address usr) internal returns (uint cdp) {\\n        cdp = IDssCdpManager(manager).openSafe(collateralType, usr);\\n    }\\n\\n    /**\\n     * @notice Locks collateral into a Safe.\\n     * @dev Deposits collateral via CollateralJoin and updates the Safe\\u2019s collateral balance.\\n     * @param manager Address of the DssCdpManager contract.\\n     * @param collateralJoin Address of the CollateralJoin contract.\\n     * @param cdp Unique identifier of the Safe.\\n     * @param amt Amount of collateral to lock [in token\\u2019s decimal precision].\\n     */\\n    function lockTokenCollateral(address manager, ICollateralJoin collateralJoin, uint cdp, uint amt) external {\\n        // Deposit collateral into SafeEngine\\n        _collateralJoin_join(collateralJoin, address(this), amt);\\n        // Update Safe\\u2019s collateral balance\\n        IDssCdpManager(manager).safeEngine().modifySAFECollateralization(\\n            IDssCdpManager(manager).collateralTypes(cdp),\\n            IDssCdpManager(manager).safes(cdp),\\n            address(this),\\n            address(this),\\n            toInt(convertTo18(collateralJoin, amt)),\\n            0\\n        );\\n    }\\n\\n    /**\\n     * @notice Unlocks collateral from a Safe and withdraws it to the caller.\\n     * @dev Reduces the Safe\\u2019s collateral balance and withdraws tokens via CollateralJoin.\\n     * @param manager Address of the DssCdpManager contract.\\n     * @param collateralJoin Address of the CollateralJoin contract.\\n     * @param cdp Unique identifier of the Safe.\\n     * @param amt Amount of collateral to unlock [in token\\u2019s decimal precision].\\n     */\\n    function freeTokenCollateral(address manager, ICollateralJoin collateralJoin, uint cdp, uint amt) external {\\n        uint wad = convertTo18(collateralJoin, amt);\\n        // Reduce Safe\\u2019s collateral balance\\n        modifySAFECollateralization(manager, cdp, -toInt(wad), 0);\\n        // Transfer collateral to proxy\\n        transferCollateral(manager, cdp, address(this), wad);\\n        // Withdraw collateral to caller\\n        collateralJoin.exit(msg.sender, amt);\\n    }\\n\\n    /**\\n     * @notice Withdraws collateral from a Safe to the caller.\\n     * @dev Transfers collateral from the Safe to the proxy and withdraws tokens via CollateralJoin.\\n     * @param manager Address of the DssCdpManager contract.\\n     * @param collateralJoin Address of the CollateralJoin contract.\\n     * @param cdp Unique identifier of the Safe.\\n     * @param amt Amount of collateral to withdraw [in token\\u2019s decimal precision].\\n     */\\n    function exitTokenCollateral(address manager, ICollateralJoin collateralJoin, uint cdp, uint amt) external {\\n        // Transfer collateral to proxy\\n        transferCollateral(manager, cdp, address(this), convertTo18(collateralJoin, amt));\\n        // Withdraw collateral to caller\\n        collateralJoin.exit(msg.sender, amt);\\n    }\\n\\n    /**\\n     * @notice Generates StablePro debt from a Safe.\\n     * @dev Increases Safe debt, transfers StablePro to the proxy, and withdraws tokens via CoinJoin.\\n     * @param manager Address of the DssCdpManager contract.\\n     * @param taxCollector Address of the TaxCollector contract.\\n     * @param coinJoin Address of the CoinJoin contract.\\n     * @param cdp Unique identifier of the Safe.\\n     * @param wad Amount of StablePro to generate [wad].\\n     * @param lockupPeriod Lockup period for the generated StablePro (protocol-specific).\\n     */\\n    function generateDebt(\\n        address manager,\\n        address taxCollector,\\n        address coinJoin,\\n        uint cdp,\\n        uint wad,\\n        uint256 lockupPeriod\\n    ) external {\\n        address safe = IDssCdpManager(manager).safes(cdp);\\n        ISafeEngine safeEngine = IDssCdpManager(manager).safeEngine();\\n        bytes32 collateralType = IDssCdpManager(manager).collateralTypes(cdp);\\n        // Generate debt in Safe\\n        modifySAFECollateralization(\\n            manager,\\n            cdp,\\n            0,\\n            _getGeneratedDeltaDebt(safeEngine, taxCollector, safe, collateralType, wad)\\n        );\\n        // Transfer StablePro to proxy\\n        transferInternalCoins(manager, cdp, address(this), toRad(wad));\\n        // Approve CoinJoin to access proxy\\u2019s StablePro\\n        if (safeEngine.cdpRights(address(this), address(coinJoin)) == 0) {\\n            safeEngine.approveSAFEModification(coinJoin);\\n        }\\n        // Withdraw StablePro to caller\\n        ICoinJoin(coinJoin).exit(collateralType, msg.sender, lockupPeriod, msg.sender, wad);\\n    }\\n\\n    /**\\n     * @notice Repays StablePro debt to a Safe.\\n     * @dev Deposits StablePro via CoinJoin and reduces Safe debt, handling ownership or permissions.\\n     * @param manager Address of the DssCdpManager contract.\\n     * @param coinJoin Address of the CoinJoin contract.\\n     * @param cdp Unique identifier of the Safe.\\n     * @param wad Amount of StablePro to repay [wad].\\n     */\\n    function repayDebt(address manager, address coinJoin, uint cdp, uint wad) external {\\n        ISafeEngine safeEngine = IDssCdpManager(manager).safeEngine();\\n        address safe = IDssCdpManager(manager).safes(cdp);\\n        bytes32 collateralType = IDssCdpManager(manager).collateralTypes(cdp);\\n\\n        address own = IDssCdpManager(manager).owns(cdp);\\n        if (own == address(this) || IDssCdpManager(manager).cdpCan(own, cdp, address(this)) == 1) {\\n            // Deposit StablePro into SafeEngine\\n            _coinJoin_join(collateralType, coinJoin, safe, wad);\\n            // Reduce Safe debt\\n            modifySAFECollateralization(\\n                manager,\\n                cdp,\\n                0,\\n                _getRepaidDeltaDebt(safeEngine, safeEngine.coinBalance(safe), safe, collateralType)\\n            );\\n        } else {\\n            // Deposit StablePro into SafeEngine\\n            _coinJoin_join(collateralType, coinJoin, address(this), wad);\\n            // Reduce Safe debt directly\\n            safeEngine.modifySAFECollateralization(\\n                collateralType,\\n                safe,\\n                address(this),\\n                address(this),\\n                0,\\n                _getRepaidDeltaDebt(safeEngine, wad * RAY, safe, collateralType)\\n            );\\n        }\\n    }\\n\\n    /**\\n     * @notice Repays all StablePro debt for a Safe.\\n     * @dev Deposits the required StablePro via CoinJoin and clears all Safe debt, handling ownership or permissions.\\n     * @param manager Address of the DssCdpManager contract.\\n     * @param coinJoin Address of the CoinJoin contract.\\n     * @param cdp Unique identifier of the Safe.\\n     */\\n    function repayAllDebt(address manager, address coinJoin, uint cdp) external {\\n        ISafeEngine safeEngine = IDssCdpManager(manager).safeEngine();\\n        address safe = IDssCdpManager(manager).safes(cdp);\\n        bytes32 collateralType = IDssCdpManager(manager).collateralTypes(cdp);\\n        (, uint safeDebt) = safeEngine.safes(collateralType, safe);\\n\\n        address own = IDssCdpManager(manager).owns(cdp);\\n        if (own == address(this) || IDssCdpManager(manager).cdpCan(own, cdp, address(this)) == 1) {\\n            // Deposit StablePro to cover all debt\\n            _coinJoin_join(collateralType, coinJoin, safe, _getRepaidAllWad(safeEngine, safe, safe, collateralType));\\n            // Clear all Safe debt\\n            modifySAFECollateralization(manager, cdp, 0, -int(safeDebt));\\n        } else {\\n            // Deposit StablePro to cover all debt\\n            _coinJoin_join(\\n                collateralType,\\n                coinJoin,\\n                address(this),\\n                _getRepaidAllWad(safeEngine, address(this), safe, collateralType)\\n            );\\n            // Clear all Safe debt directly\\n            safeEngine.modifySAFECollateralization(\\n                collateralType,\\n                safe,\\n                address(this),\\n                address(this),\\n                0,\\n                -int(safeDebt)\\n            );\\n        }\\n    }\\n\\n    /**\\n     * @notice Locks collateral and generates StablePro debt in a single transaction.\\n     * @dev Combines collateral deposit and debt generation for efficiency.\\n     * @param manager Address of the DssCdpManager contract.\\n     * @param taxCollector Address of the TaxCollector contract.\\n     * @param collateralJoin Address of the CollateralJoin contract.\\n     * @param coinJoin Address of the CoinJoin contract.\\n     * @param cdp Unique identifier of the Safe.\\n     * @param collateralAmount Amount of collateral to lock [in token\\u2019s decimal precision].\\n     * @param deltaWad Amount of StablePro debt to generate [wad].\\n     * @param lockupPeriod Lockup period for the generated StablePro (protocol-specific).\\n     */\\n    function lockTokenCollateralAndGenerateDebt(\\n        address manager,\\n        address taxCollector,\\n        ICollateralJoin collateralJoin,\\n        address coinJoin,\\n        uint cdp,\\n        uint collateralAmount,\\n        uint deltaWad,\\n        uint256 lockupPeriod\\n    ) public {\\n        address safeHandler = IDssCdpManager(manager).safes(cdp);\\n        ISafeEngine safeEngine = IDssCdpManager(manager).safeEngine();\\n        bytes32 collateralType = IDssCdpManager(manager).collateralTypes(cdp);\\n        // Deposit collateral into SafeEngine\\n        _collateralJoin_join(collateralJoin, safeHandler, collateralAmount);\\n        // Update Safe: add collateral and debt\\n        modifySAFECollateralization(\\n            manager,\\n            cdp,\\n            toInt(convertTo18(collateralJoin, collateralAmount)),\\n            _getGeneratedDeltaDebt(safeEngine, taxCollector, safeHandler, collateralType, deltaWad)\\n        );\\n        // Transfer StablePro to proxy\\n        transferInternalCoins(manager, cdp, address(this), toRad(deltaWad));\\n        // Approve CoinJoin to access proxy\\u2019s StablePro\\n        if (safeEngine.cdpRights(address(this), address(coinJoin)) == 0) {\\n            safeEngine.approveSAFEModification(coinJoin);\\n        }\\n        // Withdraw StablePro to caller\\n        ICoinJoin(coinJoin).exit(collateralType, msg.sender, lockupPeriod, msg.sender, deltaWad);\\n    }\\n\\n    /**\\n     * @notice Opens a Safe, locks collateral, and generates StablePro debt in a single transaction.\\n     * @dev Combines Safe creation, collateral deposit, and debt generation for efficiency.\\n     * @param manager Address of the DssCdpManager contract.\\n     * @param taxCollector Address of the TaxCollector contract.\\n     * @param collateralJoin Address of the CollateralJoin contract.\\n     * @param coinJoin Address of the CoinJoin contract.\\n     * @param collateralType Unique identifier for the collateral type.\\n     * @param amtC Amount of collateral to lock [in token\\u2019s decimal precision].\\n     * @param wadD Amount of StablePro debt to generate [wad].\\n     * @param lockupPeriod Lockup period for the generated StablePro (protocol-specific).\\n     * @return cdp Unique identifier of the newly created Safe.\\n     */\\n    function openLockTokenCollateralAndGenerateDebt(\\n        address manager,\\n        address taxCollector,\\n        ICollateralJoin collateralJoin,\\n        address coinJoin,\\n        bytes32 collateralType,\\n        uint amtC,\\n        uint wadD,\\n        uint256 lockupPeriod\\n    ) external returns (uint cdp) {\\n        // Create new Safe\\n        cdp = openSafe(manager, collateralType, address(this));\\n        // Lock collateral and generate debt\\n        lockTokenCollateralAndGenerateDebt(\\n            manager, taxCollector, collateralJoin, coinJoin, cdp, amtC, wadD, lockupPeriod\\n        );\\n    }\\n\\n    /**\\n     * @notice Repays StablePro debt and unlocks collateral from a Safe in a single transaction.\\n     * @dev Combines debt repayment and collateral withdrawal for efficiency.\\n     * @param manager Address of the DssCdpManager contract.\\n     * @param collateralJoin Address of the CollateralJoin contract.\\n     * @param coinJoin Address of the CoinJoin contract.\\n     * @param cdp Unique identifier of the Safe.\\n     * @param amtC Amount of collateral to unlock [in token\\u2019s decimal precision].\\n     * @param wadD Amount of StablePro to repay [wad].\\n     */\\n    function repayDebtAndFreeTokenCollateral(\\n        address manager,\\n        ICollateralJoin collateralJoin,\\n        address coinJoin,\\n        uint cdp,\\n        uint amtC,\\n        uint wadD\\n    ) external {\\n        address safe = IDssCdpManager(manager).safes(cdp);\\n        bytes32 collateralType = IDssCdpManager(manager).collateralTypes(cdp);\\n        ISafeEngine safeEngine = IDssCdpManager(manager).safeEngine();\\n        // Deposit StablePro into SafeEngine\\n        _coinJoin_join(collateralType, coinJoin, safe, wadD);\\n        uint wadC = convertTo18(collateralJoin, amtC);\\n        // Reduce debt and unlock collateral\\n        modifySAFECollateralization(\\n            manager,\\n            cdp,\\n            -toInt(wadC),\\n            _getRepaidDeltaDebt(\\n                safeEngine,\\n                safeEngine.coinBalance(safe),\\n                safe,\\n                collateralType\\n            )\\n        );\\n        // Transfer collateral to proxy\\n        transferCollateral(manager, cdp, address(this), wadC);\\n        // Withdraw collateral to caller\\n        collateralJoin.exit(msg.sender, amtC);\\n    }\\n\\n    /**\\n     * @notice Repays all StablePro debt and unlocks collateral from a Safe in a single transaction.\\n     * @dev Combines full debt repayment and collateral withdrawal for efficiency.\\n     * @param manager Address of the DssCdpManager contract.\\n     * @param collateralJoin Address of the CollateralJoin contract.\\n     * @param coinJoin Address of the CoinJoin contract.\\n     * @param cdp Unique identifier of the Safe.\\n     * @param amtC Amount of collateral to unlock [in token\\u2019s decimal precision].\\n     */\\n    function repayAllDebtAndFreeTokenCollateral(\\n        address manager,\\n        ICollateralJoin collateralJoin,\\n        address coinJoin,\\n        uint cdp,\\n        uint amtC\\n    ) external {\\n        ISafeEngine safeEngine = IDssCdpManager(manager).safeEngine();\\n        address safe = IDssCdpManager(manager).safes(cdp);\\n        bytes32 collateralType = IDssCdpManager(manager).collateralTypes(cdp);\\n        (, uint safeDebt) = safeEngine.safes(collateralType, safe);\\n\\n        // Deposit StablePro to cover all debt\\n        _coinJoin_join(collateralType, coinJoin, safe, _getRepaidAllWad(safeEngine, safe, safe, collateralType));\\n        uint wadC = convertTo18(collateralJoin, amtC);\\n        // Clear all debt and unlock collateral\\n        modifySAFECollateralization(\\n            manager,\\n            cdp,\\n            -toInt(wadC),\\n            -int(safeDebt)\\n        );\\n        // Transfer collateral to proxy\\n        transferCollateral(manager, cdp, address(this), wadC);\\n        // Withdraw collateral to caller\\n        collateralJoin.exit(msg.sender, amtC);\\n    }\\n\\n    /**\\n     * @notice Retrieves the Safe ID for a user\\u2019s Safe with a specific collateral type.\\n     * @dev Iterates through the user\\u2019s Safes in DssCdpManager to find the matching collateral type.\\n     * @param manager Address of the DssCdpManager contract.\\n     * @param user Address of the Safe owner.\\n     * @param collateralType Unique identifier for the collateral type.\\n     * @return cdpId Unique identifier of the Safe, or type(uint256).max if not found.\\n     */\\n    function getCdpId(address manager, address user, bytes32 collateralType) public view returns(uint) {\\n        uint256 cdpCount = IDssCdpManager(manager).cdpCount(user);\\n        uint256 cdpId = IDssCdpManager(manager).firstCdpId(user);\\n        IDssCdpManager managerContract = IDssCdpManager(manager);\\n\\n        // Iterate through user\\u2019s Safes\\n        for (uint256 i; i < cdpCount; ++i) {\\n            if (managerContract.collateralTypes(cdpId) == collateralType) {\\n                return cdpId;\\n            }\\n            (, uint256 nextCdpId) = managerContract.list(cdpId);\\n            cdpId = nextCdpId;\\n        }\\n\\n        return type(uint256).max;\\n    }\\n\\n    /**\\n     * @notice Retrieves collateral and debt information for a user\\u2019s Safe.\\n     * @dev Queries SafeEngine for the Safe\\u2019s locked collateral and generated debt.\\n     * @param manager Address of the DssCdpManager contract.\\n     * @param user Address of the Safe owner.\\n     * @param collateralType Unique identifier for the collateral type.\\n     * @return lockedCollateral Amount of locked collateral [wad].\\n     * @return generatedDebt Amount of generated debt [wad].\\n     */\\n    function getCdpInfo(address manager, address user, bytes32 collateralType) public view returns(uint, uint) {\\n        uint256 cdpId = getCdpId(manager, user, collateralType);\\n        if (cdpId == type(uint256).max) return (0,0);\\n\\n        ISafeEngine safeEngine = IDssCdpManager(manager).safeEngine();\\n        address safe = IDssCdpManager(manager).safes(cdpId);\\n        return safeEngine.safes(collateralType, safe);\\n    }\\n\\n    /**\\n     * @notice Calculates the amount of collateral a user can withdraw from a Safe.\\n     * @dev Determines excess collateral based on the Safe\\u2019s collateralization ratio and safety price.\\n     * @param manager Address of the DssCdpManager contract.\\n     * @param user Address of the Safe owner.\\n     * @param collateralType Unique identifier for the collateral type.\\n     * @return Amount of collateral available to withdraw [wad].\\n     */\\n    function getAvailableToWithdraw(address manager, address user, bytes32 collateralType) external view returns(uint) {\\n        ISafeEngine safeEngine = IDssCdpManager(manager).safeEngine();\\n\\n        (uint256 lockedCollateral, uint256 generatedDebt) = getCdpInfo(manager, user, collateralType);\\n        (, uint rate,,, uint safetyPrice,,,) = safeEngine.collateralTypes(collateralType);\\n\\n        // Return 0 if safety price is unset\\n        if (safetyPrice == 0) return 0;\\n\\n        // Calculate minimum required collateral\\n        uint256 minCollateralAmount = mul(generatedDebt, rate) / safetyPrice;\\n        return lockedCollateral > minCollateralAmount ? sub(lockedCollateral, minCollateralAmount) : 0;\\n    }\\n\\n    /**\\n     * @notice Calculates the amount of StablePro a user can borrow from a Safe.\\n     * @dev Determines borrowing capacity based on collateral value, debt limits, and safety price.\\n     * @param manager Address of the DssCdpManager contract.\\n     * @param user Address of the Safe owner.\\n     * @param collateralType Unique identifier for the collateral type.\\n     * @return Amount of StablePro available to borrow [wad].\\n     */\\n    function getAvailableToBorrow(address manager, address user, bytes32 collateralType) external view returns(uint) {\\n        ISafeEngine safeEngine = IDssCdpManager(manager).safeEngine();\\n\\n        (uint256 lockedCollateral, uint256 generatedDebt) = getCdpInfo(manager, user, collateralType);\\n        (\\n            uint256 debtAmount, uint256 rate, uint256 debtCeiling,, uint safetyPrice,,,\\n        ) = safeEngine.collateralTypes(collateralType);\\n\\n        // Calculate borrowing limit based on collateral value\\n        uint256 usdLimitE18 = mul(lockedCollateral, safetyPrice) / rate;\\n        if (usdLimitE18 > generatedDebt) {\\n            uint256 availableToBorrow = sub(usdLimitE18, generatedDebt);\\n\\n            // Check global debt ceiling\\n            uint256 globalAvailableToBorrow = sub(safeEngine.globalDebtCeiling(), safeEngine.globalDebt());\\n            if (globalAvailableToBorrow < toRad(availableToBorrow)) return globalAvailableToBorrow / RAY;\\n\\n            // Check collateral type debt ceiling\\n            uint256 collateralAvailableToBorrow = sub(debtCeiling, toRad(debtAmount));\\n            if (collateralAvailableToBorrow < toRad(add(debtAmount, availableToBorrow))) {\\n                return collateralAvailableToBorrow / RAY;\\n            }\\n\\n            return availableToBorrow;\\n        }\\n\\n        return 0;\\n    }\\n}\\n\",\"keccak256\":\"0x188a273dae274f37f84135f8ba162868ac3f67ca59e9227d8ee2567fc630e2a4\",\"license\":\"AGPL-3.0-or-later\"},\"contracts/makerdao/interfaces/ICoin.sol\":{\"content\":\"// SPDX-License-Identifier: UNLICENSED\\n\\npragma solidity ^0.8.0;\\n\\nimport \\\"@openzeppelin/contracts/token/ERC20/IERC20.sol\\\";\\n\\ninterface ICoin is IERC20 {\\n    function mint(address account, uint256 amount) external;\\n    function burn(address account, uint256 amount) external;\\n}\\n\",\"keccak256\":\"0x4552a784b9f87c84a4badb298c1d007873304f0f1da6b896defac2df25325f1b\",\"license\":\"UNLICENSED\"},\"contracts/makerdao/interfaces/ICoinJoin.sol\":{\"content\":\"// SPDX-License-Identifier: UNLICENSED\\n\\npragma solidity ^0.8.0;\\n\\nimport {IDisable} from \\\"./IDisable.sol\\\";\\nimport {ICoin} from \\\"./ICoin.sol\\\";\\n\\n/**\\n * @title ITaxCollector\\n **/\\ninterface ICoinJoin is IDisable {\\n    /* ==================== EVENTS ==================== */\\n    event Join(address indexed usr, uint256 wad);\\n    event JoinNoReward(address indexed usr, uint256 wad);\\n    event Exit(address indexed usr, uint256 wad);\\n    event ExitNoReward(address indexed usr, uint256 wad);\\n    event UpdateRewardChef();\\n    event DecreaseAmountFailed(address indexed collateralType, address indexed user, uint amount);\\n    event IncreaseAmountFailed(\\n        address indexed collateralType,\\n        address indexed user,\\n        uint amount,\\n        uint256 lockupPeriodSeconds\\n    );\\n\\n    /* ===================== ERRORS ==================== */\\n    error BadLockupPeriod();\\n\\n    /* ====================== VARS ===================== */\\n    function systemCoin() external returns (ICoin);\\n\\n    /* ==================== METHODS ==================== */\\n\\n    /**\\n    * @notice Join pegged-coins in the system\\n    * @dev Exited coins have 18 decimals but inside the system they have 45 (rad) decimals.\\n           When we join, the amount (wad) is multiplied by 10**27 (ray).\\n           Can only be called by authorized contracts.\\n    * @param collateralType Collateral that will be used for borrow\\n    * @param user Account that call borrow/repay function and will receive rewards in RewardChef\\n    * @param cdp Account that will receive the joined coins\\n    * @param wad Amount of external coins to join (18 decimal number)\\n    **/\\n    function join(bytes32 collateralType, address user, address cdp, uint wad) external;\\n\\n    /**\\n    * @notice Simple version of join(). Don't have Rewards, it is useful for our smart-contracts.\\n    * @param cdp Account that will receive the joined coins\\n    * @param wad Amount of external coins to join (18 decimal number)\\n    **/\\n    function joinNoReward(address cdp, uint wad) external;\\n\\n    /**\\n    * @notice Exit pegged-coins from the system and inside 'Coin.sol'\\n    * @dev Inside the system, coins have 45 (rad) decimals but outside they have 18 decimals (wad).\\n           When we exit, we specify a wad amount of coins and then the contract automatically multiplies\\n           wad by 10**27 to move the correct 45 decimal coin amount to this adapter.\\n           Can only be called by authorized contracts.\\n    * @param collateralType Collateral that will be used for repay\\n    * @param user Account that call borrow/repay function and will receive rewards in RewardChef\\n    * @param lockupPeriodSeconds Lockup period for rewardChef that calculate user rewards\\n    * @param cdp Account that will receive the exited coins\\n    * @param wad Amount of internal coins to join (18 decimal number that will be multiplied by ray)\\n    **/\\n    function exit(bytes32 collateralType, address user, uint256 lockupPeriodSeconds, address cdp, uint wad) external;\\n\\n    /**\\n    * @notice Simple version of exit(). Don't have Rewards, it is useful for our smart-contracts.\\n    * @param cdp Account that will receive the joined coins\\n    * @param wad Amount of external coins to join (18 decimal number)\\n    **/\\n    function exitNoReward(address cdp, uint wad) external;\\n\\n    /**\\n    * @notice We use rewardChef to increaseAmount/decreaseAmount during join and exit,\\n    * so admin should be able to change RewardChef contract's address.\\n    * @param rewardChef New address of RewardChef contract.\\n    **/\\n    //function updateRewardChef(address rewardChef) external;\\n\\n    /**\\n    * @notice We need to save mapping of collateralType => collateralAddress to work with RewardChef.\\n    * @param _collateralType Collateral type as bytes32, that we use in our protocol.\\n    * @param _collateralAddress Address of collateral\\n    **/\\n    function initializeCollateralType(bytes32 _collateralType, address _collateralAddress) external;\\n}\\n\",\"keccak256\":\"0x5d275a80f44bb2dc7d1c13696f40a2f7a52a638b07c4a4221fef96e5e72e4cef\",\"license\":\"UNLICENSED\"},\"contracts/makerdao/interfaces/ICollateralJoin.sol\":{\"content\":\"// SPDX-License-Identifier: UNLICENSED\\n\\npragma solidity ^0.8.0;\\n\\nimport \\\"@openzeppelin/contracts/token/ERC20/extensions/IERC20Metadata.sol\\\";\\nimport {IDisable} from \\\"./IDisable.sol\\\";\\n\\n/**\\n * @title ITaxCollector\\n **/\\ninterface ICollateralJoin is IDisable {\\n\\n    /* ===================== EVENTS ===================== */\\n\\n    event Join(address indexed usr, uint256 wad);\\n    event Exit(address indexed usr, uint256 wad);\\n\\n    /* ====================== VARS ===================== */\\n    function decimals() external returns (uint);\\n    function collateral() external view returns(IERC20Metadata);\\n\\n    /* ==================== METHODS ==================== */\\n\\n    /**\\n    * @notice Join collateral in the system\\n    * @param usr Account from which we transferFrom collateral and add it in the system\\n    * @param wad Amount of collateral to transfer in the system (represented as a number with 18 decimals)\\n    **/\\n    function join(address usr, uint wad) external;\\n\\n    /**\\n    * @notice Exit collateral from the system\\n    * @param usr Account to which we transfer the collateral\\n    * @param wad Amount of collateral to transfer to 'account' (represented as a number with 18 decimals)\\n    **/\\n    function exit(address usr, uint wad) external;\\n}\\n\",\"keccak256\":\"0xb276834f1935ca409ecca5542ef257f9b68e1e91c53b9bdc6b73f0db63210c07\",\"license\":\"UNLICENSED\"},\"contracts/makerdao/interfaces/IDisable.sol\":{\"content\":\"// SPDX-License-Identifier: UNLICENSED\\n\\npragma solidity ^0.8.0;\\n\\ninterface IDisable {\\n    event DisableContract();\\n\\n    function disableContract() external;\\n}\\n\",\"keccak256\":\"0xcf4b5ac43556af77a174aa3a3a9b51c4fc89b933ef875797650542bf686b8405\",\"license\":\"UNLICENSED\"},\"contracts/makerdao/interfaces/IDssCdpManager.sol\":{\"content\":\"// SPDX-License-Identifier: UNLICENSED\\n\\npragma solidity ^0.8.0;\\n\\nimport \\\"../interfaces/ISafeEngine.sol\\\";\\n\\n/**\\n * @title IDssMiddleware\\n **/\\ninterface IDssCdpManager {\\n\\n    /* ==================== STRUCTS ==================== */\\n\\n    struct List {\\n        uint prev;\\n        uint next;\\n    }\\n\\n    /* ==================== EVENTS ===================== */\\n\\n    event Initialize(address indexed cdpManager);\\n    event NewCdp(address indexed usr, address indexed own, uint indexed cdp);\\n    event CdpAllow(uint256 cdpId, address usr, uint256 ok);\\n    event AllowHandler(address indexed urn, address usr, uint256 ok);\\n    event TransferSafeOwnership(uint256 cdpId, address src, address dst);\\n    event ModifySAFECollateralization(uint256 cdpId, int256 deltaCollateral, int256 deltaDebt);\\n    event TransferCollateral(uint256 cdpId, bytes32 collateralType, address dst, uint256 wad);\\n    event TransferInternalCoins(uint256 cdpId, address dst, uint256 rad);\\n    event Quit(uint256 cdpId, address dst);\\n    event Enter(address src, uint256 cdpId);\\n    event MoveSAFE(uint256 cdpSrc, uint256 cdpDst);\\n\\n\\n    /* ===================== VARS ====================== */\\n\\n    // @notice CDPId => CollateralType\\n    function collateralTypes(uint cdp) external view returns (bytes32);\\n    // @notice CDPId => CdpHandler\\n    function safes(uint cdp) external view returns (address);\\n    // @notice Address of safeEngine\\n    function safeEngine() external view returns (ISafeEngine);\\n    // @notice CDPId => Owner\\n    function owns(uint cdp) external view returns (address);\\n    // @notice Owner => CDPId => Allowed Addr => True/False\\n    function cdpCan(address owner, uint cdp, address allowedAddress) external view returns (uint);\\n    // @notice Owner => Amount of CDPs\\n    function cdpCount(address owner) external view returns (uint);\\n    // @notice Owner => First CDPId\\n    function firstCdpId(address owner) external view returns (uint);\\n    // @notice Owner => Last CDPId\\n    function lastCdpId(address owner) external view returns (uint);\\n    // @notice CDPId => Prev & Next CDPIds (double linked list)\\n    function list(uint cdp) external view returns (uint prev, uint next);\\n\\n    /* ==================== METHODS ==================== */\\n\\n    // @notice Allow/disallow a usr address to manage the cdp.\\n    function cdpAllow(uint cdp, address usr, uint ok) external;\\n\\n    // @notice Allow/disallow a usr address to quit to the the sender urn.\\n    function allowHandler(address usr, uint ok) external;\\n\\n    // @notice Open a new cdp for a given usr address.\\n    function openSafe(bytes32 collateralType, address usr) external returns (uint);\\n\\n    // @notice Give the cdp ownership to a dst address.\\n    function transferSafeOwnership(uint cdp, address dst) external;\\n\\n    // @notice Modify the cdp keeping the generated StablePro or collateral freed in the cdp urn address.\\n    function modifySAFECollateralization(uint cdp, int deltaCollateral, int deltaDebt) external;\\n\\n    // @notice Transfer wad amount of cdp collateral from the cdp address to a dst address.\\n    function transferCollateral(uint cdp, address dst, uint wad) external;\\n\\n    // @notice Transfer wad amount of any type of collateral (ilk) from the cdp address to a dst address.\\n    // This function has the purpose to take away collateral from the system that doesn't correspond to the cdp\\n    // but was sent there wrongly.\\n    function transferCollateral(bytes32 ilk, uint cdp, address dst, uint wad) external;\\n\\n    // @notice Transfer wad amount of StablePro from the cdp address to a dst address.\\n    function transferInternalCoins(uint cdp, address dst, uint rad) external;\\n\\n    // @notice Quit the system, migrating the cdp (lockedCollateral, generatedDebt) to a different dst urn\\n    function quit(uint cdp, address dst) external;\\n\\n    // @notice Import a position from src urn to the urn owned by cdp\\n    function enter(address src, uint cdp) external;\\n\\n    // @notice Move a position from cdpSrc urn to the cdpDst urn\\n    function moveSAFE(uint cdpSrc, uint cdpDst) external;\\n}\\n\",\"keccak256\":\"0x2aa58063f481bbee6f04674b5c451872b0bc3870f8b48e6b9cb509dd9018d8d3\",\"license\":\"UNLICENSED\"},\"contracts/makerdao/interfaces/ISafeEngine.sol\":{\"content\":\"// SPDX-License-Identifier: UNLICENSED\\n// TODO: check how to operate with license and use one for all contracts\\n\\npragma solidity ^0.8.0;\\n\\nimport \\\"./IDisable.sol\\\";\\n\\n/**\\n * @title SafeEngine\\n * @notice The single source of truth for the Maker Protocol. It contains the accounting system of the core Vault,\\n * Internal StablePro balances, and collateral state. It houses the public interface for Vault management,\\n * allowing safe(= CDP or Vault) owners to adjust their Vault state balances. It also contains the public interface\\n * for Vault fungibility, allowing safe (Vault) owners to transfer, split, and merge Vaults.\\n * Excluding these interfaces, SAFEEngine is accessed through trusted smart contract modules.\\n **/\\ninterface ISafeEngine is IDisable {\\n\\n          // --- Events ---\\n    event InitializeCollateralType(bytes32 collateralType);\\n    event ModifyParameters(bytes32 what, uint256 data);\\n    event ModifyParameters(bytes32 collateralType, bytes32 what, uint256 data);\\n    event ModifyCollateralBalance(bytes32 collateralType, address usr, int256 wad);\\n    event TransferCollateral(bytes32 collateralType, address src, address dst, uint256 wad);\\n    event TransferInternalCoins(address src, address dst, uint256 rad);\\n    event ModifySAFECollateralization(\\n        bytes32 collateralType,\\n        address cdp,\\n        address collateralSource,\\n        address debtDestination,\\n        int256 deltaCollateral,\\n        int256 deltaDebt,\\n        uint256 lockedCollateral,\\n        uint256 generatedDebt,\\n        uint256 globalDebt\\n    );\\n    event TransferSAFECollateralAndDebt(\\n        bytes32 collateralType,\\n        address src,\\n        address dst,\\n        int256 deltaCollateral,\\n        int256 deltaDebt,\\n        uint256 srcLockedCollateral,\\n        uint256 srcGeneratedDebt,\\n        uint256 dstLockedCollateral,\\n        uint256 dstGeneratedDebt\\n    );\\n    event ConfiscateSAFECollateralAndDebt(\\n        bytes32 collateralType,\\n        address cdp,\\n        address collateralCounterparty,\\n        address debtCounterparty,\\n        int256 deltaCollateral,\\n        int256 deltaDebt,\\n        uint256 globalUnbackedDebt\\n    );\\n    event SettleDebt(address account, uint256 rad, uint256 debtBalance, uint256 coinBalance, uint256 globalUnbackedDebt, uint256 globalDebt);\\n    event CreateUnbackedDebt(\\n        address debtDestination,\\n        address coinDestination,\\n        uint256 rad,\\n        uint256 debtBalance,\\n        uint256 coinBalance,\\n        uint256 globalUnbackedDebt,\\n        uint256 globalDebt\\n    );\\n    event UpdateAccumulatedRate(bytes32 collateralType, address surplusDst, int256 accumulatedRate, uint256 globalDebt);\\n    event ApproveSAFEModification(address sender, address usr);\\n    event DenySAFEModification(address sender, address usr);\\n    event UpdateSafetyPrice(bytes32 collateralType, uint256 safetyPrice);\\n\\n    /* ==================== METHODS ==================== */\\n\\n    // --- Data ---\\n    struct CollateralType {\\n        uint256 debtAmount;        // Total debt issued for this specific collateral type                          [wad]\\n        uint256 accumulatedRate;   // Accumulator for interest accrued on this collateral type                     [ray]\\n        uint256 debtCeiling;       // Maximum amount of debt that can be generated with this collateral type       [rad]\\n        uint256 debtFloor;         // Minimum amount of debt that must be generated by a CDP using this collateral [rad]\\n        uint256 safetyPrice;       // Floor price at which a CDP is allowed to generate debt                       [ray]\\n        uint256 liquidationRatio;  // Liquidation ratio to calculate safety price                                  [ray]\\n        address collateralAddress; // Address of collateral\\n        uint256 safetyPriceBlockNumber; // Block when safetyPrice was updated\\n    }\\n    struct SAFE {\\n        uint256 lockedCollateral; // Total amount of collateral locked in a SAFE/CDP  [wad]\\n        uint256 generatedDebt;    // Total amount of debt generated by a SAFE/CDP     [wad]\\n    }\\n\\n    // --- VARS ---\\n\\n    function safes(bytes32, address) external view returns (uint, uint);\\n\\n    function collateralTypes(bytes32) external view returns (\\n        uint256 debtAmount,       // [wad]\\n        uint256 accumulatedRate,  // [ray]\\n        uint256 debtCeiling,      // [rad]\\n        uint256 debtFloor,        // [rad]\\n        uint256 safetyPrice,      // [ray]\\n        uint256 liquidationRatio, // [ray]\\n        address collateralAddress,\\n        uint256 safetyPriceBlockNumber\\n);\\n\\n    function tokenCollateral(bytes32, address) external view returns (uint256);\\n\\n    function coinBalance(address) external view returns (uint256);\\n\\n    function debtBalance(address) external view returns (uint256);\\n\\n    function cdpRights(address, address) external view returns (uint256);\\n\\n    function globalDebtCeiling() external view returns (uint256);\\n\\n    function globalDebt() external view returns (uint256);\\n\\n    // --- Auth ---\\n    /**\\n     * @notice Allow an address to modify your CDP.\\n     * For example coinAdapter should be able to modify your CDP to withdraw all correctly.\\n     * @param usr Account to give CDP permissions to\\n     */\\n    function approveSAFEModification(address usr) external;\\n\\n    /**\\n     * @notice Deny an address the rights to modify your CDP\\n     * @param usr Account to give CDP permissions to\\n     */\\n    function denySAFEModification(address usr) external;\\n\\n    // --- Administration ---\\n\\n    function initializeCollateralType(bytes32 collateralType, address collateralAddress) external;\\n\\n    /**\\n     * @notice Method to modify some global variables\\n     * @param what - name of variable we want to change\\n     * @param data - new value of this variable\\n     */\\n    function modifyParameters(bytes32 what, uint data) external;\\n    /**\\n     * @notice Method to modify values in struct of collateralTypes\\n     * @param collateralType - collateral type we want to modify (collateralTypes[collateralType])\\n     * @param what - name of variable in struct we want to change\\n     * @param data - new value of this variable\\n     */\\n    function modifyParameters(bytes32 collateralType, bytes32 what, uint data) external;\\n\\n    // --- Fungibility ---\\n    function modifyCollateralBalance(bytes32 collateralType, address usr, int256 wad) external;\\n    function transferCollateral(bytes32 collateralType, address src, address dst, uint256 wad) external;\\n    function transferInternalCoins(address src, address dst, uint256 rad) external;\\n\\n    // --- SafetyPrice Manipulation ---\\n    /**\\n     * @notice Method to update safetyPrice, it's called each time, when function need actual safetyPrice\\n     * @param collateralType - safetyPrice's collateral type we want to update\\n     */\\n    function updateSafetyPrice(bytes32 collateralType) external;\\n\\n    // --- CDP Manipulation ---\\n    /**\\n     * @notice Add/remove collateral or put back/generate more debt in a CDP\\n     * @param collateralType Type of collateral to withdraw/deposit in and from the CDP\\n     * @param cdp Target CDP\\n     * @param collateralSource Account we take collateral from/put collateral into\\n     * @param debtDestination Account from which we credit/debit coins and debt\\n     * @param deltaCollateral Amount of collateral added/extract from the CDP\\n     * @param deltaDebt Amount of debt to generate/repay\\n     */\\n    function modifySAFECollateralization(\\n        bytes32 collateralType,\\n        address cdp,\\n        address collateralSource,\\n        address debtDestination,\\n        int deltaCollateral,\\n        int deltaDebt\\n    ) external;\\n\\n    // --- CDP Fungibility ---\\n    /**\\n     * @notice Transfer collateral and/or debt between CDPs\\n     * @param collateralType Collateral type transferred between CDPs\\n     * @param src Source CDP\\n     * @param dst Destination CDP\\n     * @param deltaCollateral Amount of collateral to take/add into src and give/take from dst\\n     * @param deltaDebt Amount of debt to take/add into src and give/take from dst\\n     */\\n    function transferSAFECollateralAndDebt(\\n        bytes32 collateralType,\\n        address src,\\n        address dst,\\n        int deltaCollateral,\\n        int deltaDebt\\n    ) external;\\n\\n    // --- CDP Confiscation ---\\n    /**\\n     * @notice Normally used by the LiquidationEngine in order to confiscate collateral and\\n       debt from a CDP and give them to someone else\\n     * @param collateralType Collateral type the CDP has locked inside\\n     * @param cdp Target CDP\\n     * @param collateralCounterparty Who we take/give collateral to\\n     * @param debtCounterparty Who we take/give debt to\\n     * @param deltaCollateral Amount of collateral taken/added into the CDP\\n     * @param deltaDebt Amount of debt taken/added into the CDP\\n     */\\n    function confiscateSAFECollateralAndDebt(\\n        bytes32 collateralType,\\n        address cdp,\\n        address collateralCounterparty,\\n        address debtCounterparty,\\n        int deltaCollateral,\\n        int deltaDebt\\n    ) external;\\n\\n    // --- Settlement ---\\n    /**\\n     * @notice Nullify an amount of coins with an equal amount of debt\\n     * @param rad Amount of debt & coins to destroy (expressed as a number with 45 decimals)\\n     */\\n    function settleDebt(uint rad) external;\\n\\n    /**\\n     * @notice Usually called by CoinSavingsAccount in order to create unbacked debt\\n     * @param debtDestination Usually AccountingEngine that can settle decreaseSoldAmount with surplus\\n     * @param coinDestination Usually CoinSavingsAccount who passes the new coins to depositors\\n     * @param rad Amount of debt to create (expressed as a number with 45 decimals)\\n     */\\n    function createUnbackedDebt(address debtDestination, address coinDestination, uint rad) external;\\n\\n    // --- Rates ---\\n    /**\\n     * @notice Usually called by TaxCollector in order to accrue interest on a specific collateral type\\n     * @param collateralType Collateral type we accrue interest for\\n     * @param surplusDst Destination for amount of surplus created by applying the interest rate\\n       to debt created by CDPs with 'collateralType'\\n     * @param accumulatedRate Multiplier applied to the debtAmount in order to calculate the surplus\\n     */\\n    function updateAccumulatedRate(bytes32 collateralType, address surplusDst, int accumulatedRate) external;\\n}\\n\",\"keccak256\":\"0x02d5c0dbf9eada0f29652f21159e2d9abfa7dd37c55c136c88b3ced857629f85\",\"license\":\"UNLICENSED\"},\"contracts/makerdao/interfaces/ITaxCollector.sol\":{\"content\":\"// SPDX-License-Identifier: UNLICENSED\\n\\npragma solidity ^0.8.0;\\n\\n/**\\n * @title ITaxCollector\\n **/\\ninterface ITaxCollector {\\n    /* ==================== EVENTS ==================== */\\n    event DisableContract();\\n    event InitializeCollateralType(bytes32 collateralType);\\n    event ModifyParameters(bytes32 collateralType, bytes32 what, uint256 data);\\n    event ModifyParameters(bytes32 what, uint256 data);\\n    event ModifyParameters(bytes32 what, address data);\\n    event TaxSingle(bytes32 collateralType, uint256 rate);\\n\\n    /* ==================== STRUCTS ==================== */\\n\\n    struct CollateralType {\\n        uint256 stabilityFee;      // Collateral-specific, per-second stability fee contribution [ray]\\n        uint256 latestUpdateTime;  // Time of last taxSingle [unix epoch time]\\n    }\\n\\n\\n    /* ==================== METHODS ==================== */\\n\\n    // --- Administration ---\\n    function initializeCollateralType(bytes32 collateralType) external;\\n    function modifyParameters(bytes32 collateralType, bytes32 what, uint data) external;\\n    function modifyParameters(bytes32 what, uint data) external;\\n    function modifyParameters(bytes32 what, address data) external;\\n\\n\\n    // --- Stability Fee Collection ---\\n    /**\\n     * @notice Collect tax from a single collateral type\\n     * @param collateralType Collateral type to tax\\n     */\\n    function taxSingle(bytes32 collateralType) external returns (uint rate);\\n\\n    /**\\n     * @notice Disable this contract (normally called by Global Settlement)\\n     * @dev When we disable, the contract tries to settle as much debt as possible (if there's any) with\\n            any surplus that's left in the system. After erasing debt, the contract will either transfer any\\n            remaining surplus right away (if disableCooldown == 0) or will only record the timestamp when\\n            it was disabled\\n    **/\\n    function disableContract() external;\\n}\\n\",\"keccak256\":\"0xd1c2a2f60b781502a6a48b71f1536fc77ecc62c16af5bed0516e98bf7df3cc10\",\"license\":\"UNLICENSED\"}},\"version\":1}",
  "bytecode": "0x608060405234801561001057600080fd5b50612d59806100206000396000f3fe608060405234801561001057600080fd5b50600436106100ba5760003560e01c806303f2cd05146100bf57806313cc55e4146100d457806325817008146100e75780632af7ec8b146100fa5780632dc469a314610127578063434fa7221461013a5780636093c9751461015b57806373c152e91461016e5780637a2a1031146101815780638f86e01514610194578063ba511963146101a7578063bb44afd3146101ba578063ecef4eb9146101cd578063f7f898b0146101e0575b600080fd5b6100d26100cd3660046127b6565b6101f3565b005b6100d26100e23660046127fc565b61026e565b6100d26100f53660046127b6565b6104d7565b61010d610108366004612861565b610844565b604080519283526020830191909152015b60405180910390f35b6100d26101353660046128a2565b6109c0565b61014d610148366004612861565b610bbc565b60405190815260200161011e565b6100d26101693660046127b6565b610e64565b61014d61017c3660046128fd565b610f03565b61014d61018f366004612861565b610f2e565b6100d26101a23660046127b6565b611129565b6100d26101b53660046128fd565b6112b3565b61014d6101c8366004612861565b61157c565b6100d26101db3660046127fc565b6116c7565b6100d26101ee366004612861565b611973565b6102088483306102038786611c77565b611cfc565b60405163ef693bed60e01b81526001600160a01b0384169063ef693bed90610236903390859060040161297d565b600060405180830381600087803b15801561025057600080fd5b505af1158015610264573d6000803e3d6000fd5b5050505050505050565b60405163434efcbd60e01b8152600481018490526000906001600160a01b0388169063434efcbd90602401602060405180830381865afa1580156102b6573d6000803e3d6000fd5b505050506040513d601f19601f820116820180604052508101906102da9190612996565b6040516348c5be7f60e11b8152600481018690529091506000906001600160a01b0389169063918b7cfe90602401602060405180830381865afa158015610325573d6000803e3d6000fd5b505050506040513d601f19601f8201168201806040525081019061034991906129b3565b90506000886001600160a01b03166367aea3136040518163ffffffff1660e01b8152600401602060405180830381865afa15801561038b573d6000803e3d6000fd5b505050506040513d601f19601f820116820180604052508101906103af9190612996565b90506103bd82888587611d2c565b60006103c98987611c77565b905061045f8a886103d984611f1a565b6103e2906129e2565b61045a86876001600160a01b031663fabde80c8b6040518263ffffffff1660e01b815260040161041291906129fe565b602060405180830381865afa15801561042f573d6000803e3d6000fd5b505050506040513d601f19601f8201168201806040525081019061045391906129b3565b8a8a611f65565b612093565b61046b8a883084611cfc565b60405163ef693bed60e01b81526001600160a01b038a169063ef693bed906104999033908a9060040161297d565b600060405180830381600087803b1580156104b357600080fd5b505af11580156104c7573d6000803e3d6000fd5b5050505050505050505050505050565b6000846001600160a01b03166367aea3136040518163ffffffff1660e01b8152600401602060405180830381865afa158015610517573d6000803e3d6000fd5b505050506040513d601f19601f8201168201806040525081019061053b9190612996565b60405163434efcbd60e01b8152600481018590529091506000906001600160a01b0387169063434efcbd90602401602060405180830381865afa158015610586573d6000803e3d6000fd5b505050506040513d601f19601f820116820180604052508101906105aa9190612996565b6040516348c5be7f60e11b8152600481018690529091506000906001600160a01b0388169063918b7cfe90602401602060405180830381865afa1580156105f5573d6000803e3d6000fd5b505050506040513d601f19601f8201168201806040525081019061061991906129b3565b60405163040b0d8960e51b8152600481018790529091506000906001600160a01b03891690638161b12090602401602060405180830381865afa158015610664573d6000803e3d6000fd5b505050506040513d601f19601f820116820180604052508101906106889190612996565b90506001600160a01b03811630148061071157506040516302d75da360e51b81526001600160a01b03891690635aebb460906106cc9084908a903090600401612a12565b602060405180830381865afa1580156106e9573d6000803e3d6000fd5b505050506040513d601f19601f8201168201806040525081019061070d91906129b3565b6001145b156107a65761072282888588611d2c565b6107a18887600061045a88896001600160a01b031663fabde80c8a6040518263ffffffff1660e01b815260040161075991906129fe565b602060405180830381865afa158015610776573d6000803e3d6000fd5b505050506040513d601f19601f8201168201806040525081019061079a91906129b3565b8989611f65565b610264565b6107b282883088611d2c565b6001600160a01b0384166399bec3158385308060006107e78b6107e0676765c793fa10079d601b1b8f612a35565b8c8c611f65565b6040518763ffffffff1660e01b815260040161080896959493929190612a4c565b600060405180830381600087803b15801561082257600080fd5b505af1158015610836573d6000803e3d6000fd5b505050505050505050505050565b6000806000610854868686610f2e565b9050600019810361086c5760008092509250506109b8565b6000866001600160a01b03166367aea3136040518163ffffffff1660e01b8152600401602060405180830381865afa1580156108ac573d6000803e3d6000fd5b505050506040513d601f19601f820116820180604052508101906108d09190612996565b60405163434efcbd60e01b8152600481018490529091506000906001600160a01b0389169063434efcbd90602401602060405180830381865afa15801561091b573d6000803e3d6000fd5b505050506040513d601f19601f8201168201806040525081019061093f9190612996565b604051630f50894160e21b81529091506001600160a01b03831690633d422504906109709089908590600401612a81565b6040805180830381865afa15801561098c573d6000803e3d6000fd5b505050506040513d601f19601f820116820180604052508101906109b09190612a98565b945094505050505b935093915050565b6000856001600160a01b03166367aea3136040518163ffffffff1660e01b8152600401602060405180830381865afa158015610a00573d6000803e3d6000fd5b505050506040513d601f19601f82011682018060405250810190610a249190612996565b60405163434efcbd60e01b8152600481018590529091506000906001600160a01b0388169063434efcbd90602401602060405180830381865afa158015610a6f573d6000803e3d6000fd5b505050506040513d601f19601f82011682018060405250810190610a939190612996565b6040516348c5be7f60e11b8152600481018690529091506000906001600160a01b0389169063918b7cfe90602401602060405180830381865afa158015610ade573d6000803e3d6000fd5b505050506040513d601f19601f82011682018060405250810190610b0291906129b3565b90506000836001600160a01b0316633d42250483856040518363ffffffff1660e01b8152600401610b34929190612a81565b6040805180830381865afa158015610b50573d6000803e3d6000fd5b505050506040513d601f19601f82011682018060405250810190610b749190612a98565b915050610b8e828885610b89888889896120ce565b611d2c565b6000610b9a8987611c77565b905061045f8a88610baa84611f1a565b610bb3906129e2565b61045a866129e2565b600080846001600160a01b03166367aea3136040518163ffffffff1660e01b8152600401602060405180830381865afa158015610bfd573d6000803e3d6000fd5b505050506040513d601f19601f82011682018060405250810190610c219190612996565b9050600080610c31878787610844565b91509150600080600080866001600160a01b031663d07900bb8a6040518263ffffffff1660e01b8152600401610c6991815260200190565b61010060405180830381865afa158015610c87573d6000803e3d6000fd5b505050506040513d601f19601f82011682018060405250810190610cab9190612abc565b505050945050935093509350600083610cc48884612291565b610cce9190612b26565b905085811115610e50576000610ce482886122f6565b90506000610db48a6001600160a01b0316632efcc8666040518163ffffffff1660e01b8152600401602060405180830381865afa158015610d29573d6000803e3d6000fd5b505050506040513d601f19601f82011682018060405250810190610d4d91906129b3565b8b6001600160a01b0316638543d5e06040518163ffffffff1660e01b8152600401602060405180830381865afa158015610d8b573d6000803e3d6000fd5b505050506040513d601f19601f82011682018060405250810190610daf91906129b3565b6122f6565b9050610dbf82612343565b811015610dec57610ddb676765c793fa10079d601b1b82612b26565b9a5050505050505050505050610e5d565b6000610dfb86610daf8a612343565b9050610e0f610e0a898561235a565b612343565b811015610e3d57610e2b676765c793fa10079d601b1b82612b26565b9b505050505050505050505050610e5d565b829b505050505050505050505050610e5d565b6000985050505050505050505b9392505050565b6000610e708483611c77565b9050610e908584610e8084611f1a565b610e89906129e2565b6000612093565b610e9c85843084611cfc565b60405163ef693bed60e01b81526001600160a01b0385169063ef693bed90610eca903390869060040161297d565b600060405180830381600087803b158015610ee457600080fd5b505af1158015610ef8573d6000803e3d6000fd5b505050505050505050565b6000610f10898630612375565b9050610f2289898989858989896112b3565b98975050505050505050565b600080846001600160a01b031663b77b80e3856040518263ffffffff1660e01b8152600401610f5d91906129fe565b602060405180830381865afa158015610f7a573d6000803e3d6000fd5b505050506040513d601f19601f82011682018060405250810190610f9e91906129b3565b90506000856001600160a01b031663782c549c866040518263ffffffff1660e01b8152600401610fce91906129fe565b602060405180830381865afa158015610feb573d6000803e3d6000fd5b505050506040513d601f19601f8201168201806040525081019061100f91906129b3565b90508560005b8381101561111a576040516348c5be7f60e11b81526004810184905286906001600160a01b0384169063918b7cfe90602401602060405180830381865afa158015611064573d6000803e3d6000fd5b505050506040513d601f19601f8201168201806040525081019061108891906129b3565b036110995782945050505050610e5d565b604051634064a0cf60e11b8152600481018490526000906001600160a01b038416906380c9419e906024016040805180830381865afa1580156110e0573d6000803e3d6000fd5b505050506040513d601f19601f820116820180604052508101906111049190612a98565b94506111139150829050612b48565b9050611015565b50600019979650505050505050565b6111348330836123f1565b836001600160a01b03166367aea3136040518163ffffffff1660e01b8152600401602060405180830381865afa158015611172573d6000803e3d6000fd5b505050506040513d601f19601f820116820180604052508101906111969190612996565b6001600160a01b03166399bec315856001600160a01b031663918b7cfe856040518263ffffffff1660e01b81526004016111d291815260200190565b602060405180830381865afa1580156111ef573d6000803e3d6000fd5b505050506040513d601f19601f8201168201806040525081019061121391906129b3565b60405163434efcbd60e01b8152600481018690526001600160a01b0388169063434efcbd90602401602060405180830381865afa158015611258573d6000803e3d6000fd5b505050506040513d601f19601f8201168201806040525081019061127c9190612996565b303061129061128b8a89611c77565b611f1a565b60006040518763ffffffff1660e01b815260040161023696959493929190612a4c565b60405163434efcbd60e01b8152600481018590526000906001600160a01b038a169063434efcbd90602401602060405180830381865afa1580156112fb573d6000803e3d6000fd5b505050506040513d601f19601f8201168201806040525081019061131f9190612996565b90506000896001600160a01b03166367aea3136040518163ffffffff1660e01b8152600401602060405180830381865afa158015611361573d6000803e3d6000fd5b505050506040513d601f19601f820116820180604052508101906113859190612996565b6040516348c5be7f60e11b8152600481018890529091506000906001600160a01b038c169063918b7cfe90602401602060405180830381865afa1580156113d0573d6000803e3d6000fd5b505050506040513d601f19601f820116820180604052508101906113f491906129b3565b90506114018984886123f1565b6114208b8861141361128b8d8b611c77565b61045a868f89888d6125fe565b6114348b883061142f89612343565b61276e565b604051636d24dd6d60e11b81526001600160a01b0383169063da49bada906114629030908c90600401612b61565b602060405180830381865afa15801561147f573d6000803e3d6000fd5b505050506040513d601f19601f820116820180604052508101906114a391906129b3565b60000361150957604051631b29a84160e31b81526001600160a01b0383169063d94d4208906114d6908b906004016129fe565b600060405180830381600087803b1580156114f057600080fd5b505af1158015611504573d6000803e3d6000fd5b505050505b6040516309752ae360e31b81526001600160a01b03891690634ba957189061153d9084903390899082908c90600401612b7b565b600060405180830381600087803b15801561155757600080fd5b505af115801561156b573d6000803e3d6000fd5b505050505050505050505050505050565b600080846001600160a01b03166367aea3136040518163ffffffff1660e01b8152600401602060405180830381865afa1580156115bd573d6000803e3d6000fd5b505050506040513d601f19601f820116820180604052508101906115e19190612996565b90506000806115f1878787610844565b91509150600080846001600160a01b031663d07900bb886040518263ffffffff1660e01b815260040161162691815260200190565b61010060405180830381865afa158015611644573d6000803e3d6000fd5b505050506040513d601f19601f820116820180604052508101906116689190612abc565b505050945050509250508060000361168857600095505050505050610e5d565b6000816116958585612291565b61169f9190612b26565b90508085116116af5760006116b9565b6116b985826122f6565b9a9950505050505050505050565b60405163434efcbd60e01b8152600481018490526000906001600160a01b0388169063434efcbd90602401602060405180830381865afa15801561170f573d6000803e3d6000fd5b505050506040513d601f19601f820116820180604052508101906117339190612996565b90506000876001600160a01b03166367aea3136040518163ffffffff1660e01b8152600401602060405180830381865afa158015611775573d6000803e3d6000fd5b505050506040513d601f19601f820116820180604052508101906117999190612996565b6040516348c5be7f60e11b8152600481018790529091506000906001600160a01b038a169063918b7cfe90602401602060405180830381865afa1580156117e4573d6000803e3d6000fd5b505050506040513d601f19601f8201168201806040525081019061180891906129b3565b905061181e8987600061045a868d89888d6125fe565b61182d89873061142f89612343565b604051636d24dd6d60e11b81526001600160a01b0383169063da49bada9061185b9030908b90600401612b61565b602060405180830381865afa158015611878573d6000803e3d6000fd5b505050506040513d601f19601f8201168201806040525081019061189c91906129b3565b60000361190257604051631b29a84160e31b81526001600160a01b0383169063d94d4208906118cf908a906004016129fe565b600060405180830381600087803b1580156118e957600080fd5b505af11580156118fd573d6000803e3d6000fd5b505050505b6040516309752ae360e31b81526001600160a01b03881690634ba95718906119369084903390899082908c90600401612b7b565b600060405180830381600087803b15801561195057600080fd5b505af1158015611964573d6000803e3d6000fd5b50505050505050505050505050565b6000836001600160a01b03166367aea3136040518163ffffffff1660e01b8152600401602060405180830381865afa1580156119b3573d6000803e3d6000fd5b505050506040513d601f19601f820116820180604052508101906119d79190612996565b60405163434efcbd60e01b8152600481018490529091506000906001600160a01b0386169063434efcbd90602401602060405180830381865afa158015611a22573d6000803e3d6000fd5b505050506040513d601f19601f82011682018060405250810190611a469190612996565b6040516348c5be7f60e11b8152600481018590529091506000906001600160a01b0387169063918b7cfe90602401602060405180830381865afa158015611a91573d6000803e3d6000fd5b505050506040513d601f19601f82011682018060405250810190611ab591906129b3565b90506000836001600160a01b0316633d42250483856040518363ffffffff1660e01b8152600401611ae7929190612a81565b6040805180830381865afa158015611b03573d6000803e3d6000fd5b505050506040513d601f19601f82011682018060405250810190611b279190612a98565b60405163040b0d8960e51b815260048101889052909250600091506001600160a01b03891690638161b12090602401602060405180830381865afa158015611b73573d6000803e3d6000fd5b505050506040513d601f19601f82011682018060405250810190611b979190612996565b90506001600160a01b038116301480611c2057506040516302d75da360e51b81526001600160a01b03891690635aebb46090611bdb9084908a903090600401612a12565b602060405180830381865afa158015611bf8573d6000803e3d6000fd5b505050506040513d601f19601f82011682018060405250810190611c1c91906129b3565b6001145b15611c4757611c37838886610b8989898a8a6120ce565b6107a18887600061045a866129e2565b611c59838830610b8989308a8a6120ce565b6001600160a01b0385166399bec3158486308060006107e7896129e2565b6000610e5d82846001600160a01b031663313ce5676040518163ffffffff1660e01b81526004016020604051808303816000875af1158015611cbd573d6000803e3d6000fd5b505050506040513d601f19601f82011682018060405250810190611ce191906129b3565b611cec906012612ba9565b611cf790600a612ca0565b612291565b60405163438ac0d160e11b81526001600160a01b0385169063871581a29061023690869086908690600401612cac565b826001600160a01b031663a7e944556040518163ffffffff1660e01b81526004016020604051808303816000875af1158015611d6c573d6000803e3d6000fd5b505050506040513d601f19601f82011682018060405250810190611d909190612996565b6001600160a01b03166323b872dd3330846040518463ffffffff1660e01b8152600401611dbf93929190612ccb565b6020604051808303816000875af1158015611dde573d6000803e3d6000fd5b505050506040513d601f19601f82011682018060405250810190611e029190612cef565b50826001600160a01b031663a7e944556040518163ffffffff1660e01b81526004016020604051808303816000875af1158015611e43573d6000803e3d6000fd5b505050506040513d601f19601f82011682018060405250810190611e679190612996565b6001600160a01b031663095ea7b384836040518363ffffffff1660e01b8152600401611e9492919061297d565b6020604051808303816000875af1158015611eb3573d6000803e3d6000fd5b505050506040513d601f19601f82011682018060405250810190611ed79190612cef565b506040516319b6fb0160e01b8152600481018590523360248201526001600160a01b038381166044830152606482018390528416906319b6fb0190608401610236565b806000811215611f605760405162461bcd60e51b815260206004820152600c60248201526b696e742d6f766572666c6f7760a01b60448201526064015b60405180910390fd5b919050565b60405163d07900bb60e01b81526004810182905260009081906001600160a01b0387169063d07900bb9060240161010060405180830381865afa158015611fb0573d6000803e3d6000fd5b505050506040513d601f19601f82011682018060405250810190611fd49190612abc565b5050505050509150506000866001600160a01b0316633d42250485876040518363ffffffff1660e01b815260040161200d929190612a81565b6040805180830381865afa158015612029573d6000803e3d6000fd5b505050506040513d601f19601f8201168201806040525081019061204d9190612a98565b915061205e905061128b8388612b26565b92508083111561207f5761207181611f1a565b61207a906129e2565b612088565b612088836129e2565b979650505050505050565b6040516318f0203f60e31b81526004810184905260248101839052604481018290526001600160a01b0385169063c78101f890606401610236565b60405163d07900bb60e01b81526004810182905260009081906001600160a01b0387169063d07900bb9060240161010060405180830381865afa158015612119573d6000803e3d6000fd5b505050506040513d601f19601f8201168201806040525081019061213d9190612abc565b5050505050509150506000866001600160a01b0316633d42250485876040518363ffffffff1660e01b8152600401612176929190612a81565b6040805180830381865afa158015612192573d6000803e3d6000fd5b505050506040513d601f19601f820116820180604052508101906121b69190612a98565b9150506000876001600160a01b031663fabde80c886040518263ffffffff1660e01b81526004016121e791906129fe565b602060405180830381865afa158015612204573d6000803e3d6000fd5b505050506040513d601f19601f8201168201806040525081019061222891906129b3565b9050600061223f6122398486612291565b836122f6565b9050612256676765c793fa10079d601b1b82612b26565b94508061226e86676765c793fa10079d601b1b612291565b106122795784612284565b612284856001612d11565b9998505050505050505050565b60008115806122b5575082826122a78183612a35565b92506122b39083612b26565b145b6122f05760405162461bcd60e51b815260206004820152600c60248201526b6d756c2d6f766572666c6f7760a01b6044820152606401611f57565b92915050565b6000826123038382612ba9565b91508111156122f05760405162461bcd60e51b815260206004820152600c60248201526b7375622d6f766572666c6f7760a01b6044820152606401611f57565b60006122f082676765c793fa10079d601b1b612291565b6000826123678382612d11565b91508110156122f057600080fd5b6040516339855fd160e11b81526000906001600160a01b0385169063730abfa2906123a69086908690600401612a81565b6020604051808303816000875af11580156123c5573d6000803e3d6000fd5b505050506040513d601f19601f820116820180604052508101906123e991906129b3565b949350505050565b826001600160a01b031663d8dfeb456040518163ffffffff1660e01b8152600401602060405180830381865afa15801561242f573d6000803e3d6000fd5b505050506040513d601f19601f820116820180604052508101906124539190612996565b6001600160a01b03166323b872dd3330846040518463ffffffff1660e01b815260040161248293929190612ccb565b6020604051808303816000875af11580156124a1573d6000803e3d6000fd5b505050506040513d601f19601f820116820180604052508101906124c59190612cef565b50826001600160a01b031663d8dfeb456040518163ffffffff1660e01b8152600401602060405180830381865afa158015612504573d6000803e3d6000fd5b505050506040513d601f19601f820116820180604052508101906125289190612996565b6001600160a01b031663095ea7b384836040518363ffffffff1660e01b815260040161255592919061297d565b6020604051808303816000875af1158015612574573d6000803e3d6000fd5b505050506040513d601f19601f820116820180604052508101906125989190612cef565b50604051633b4da69f60e01b81526001600160a01b03841690633b4da69f906125c7908590859060040161297d565b600060405180830381600087803b1580156125e157600080fd5b505af11580156125f5573d6000803e3d6000fd5b50505050505050565b6040516336286ddd60e11b81526004810183905260009081906001600160a01b03871690636c50dbba906024016020604051808303816000875af115801561264a573d6000803e3d6000fd5b505050506040513d601f19601f8201168201806040525081019061266e91906129b3565b90506000876001600160a01b031663fabde80c876040518263ffffffff1660e01b815260040161269e91906129fe565b602060405180830381865afa1580156126bb573d6000803e3d6000fd5b505050506040513d601f19601f820116820180604052508101906126df91906129b3565b90506126f684676765c793fa10079d601b1b612291565b811015612763576127298261271f61271987676765c793fa10079d601b1b612291565b846122f6565b61128b9190612b26565b925061274084676765c793fa10079d601b1b612291565b61274a8484612291565b106127555782612760565b612760836001612d24565b92505b505095945050505050565b60405163660e160760e01b81526001600160a01b0385169063660e16079061023690869086908690600401612cac565b6001600160a01b03811681146127b357600080fd5b50565b600080600080608085870312156127cc57600080fd5b84356127d78161279e565b935060208501356127e78161279e565b93969395505050506040820135916060013590565b60008060008060008060c0878903121561281557600080fd5b86356128208161279e565b955060208701356128308161279e565b945060408701356128408161279e565b959894975094956060810135955060808101359460a0909101359350915050565b60008060006060848603121561287657600080fd5b83356128818161279e565b925060208401356128918161279e565b929592945050506040919091013590565b600080600080600060a086880312156128ba57600080fd5b85356128c58161279e565b945060208601356128d58161279e565b935060408601356128e58161279e565b94979396509394606081013594506080013592915050565b600080600080600080600080610100898b03121561291a57600080fd5b88356129258161279e565b975060208901356129358161279e565b965060408901356129458161279e565b955060608901356129558161279e565b979a969950949760808101359660a0820135965060c0820135955060e0909101359350915050565b6001600160a01b03929092168252602082015260400190565b6000602082840312156129a857600080fd5b8151610e5d8161279e565b6000602082840312156129c557600080fd5b5051919050565b634e487b7160e01b600052601160045260246000fd5b6000600160ff1b82016129f7576129f76129cc565b5060000390565b6001600160a01b0391909116815260200190565b6001600160a01b0393841681526020810192909252909116604082015260600190565b80820281158282048414176122f0576122f06129cc565b9586526001600160a01b039485166020870152928416604086015292166060840152608083019190915260a082015260c00190565b9182526001600160a01b0316602082015260400190565b60008060408385031215612aab57600080fd5b505080516020909101519092909150565b600080600080600080600080610100898b031215612ad957600080fd5b885197506020890151965060408901519550606089015194506080890151935060a0890151925060c0890151612b0e8161279e565b8092505060e089015190509295985092959890939650565b600082612b4357634e487b7160e01b600052601260045260246000fd5b500490565b600060018201612b5a57612b5a6129cc565b5060010190565b6001600160a01b0392831681529116602082015260400190565b9485526001600160a01b03938416602086015260408501929092529091166060830152608082015260a00190565b818103818111156122f0576122f06129cc565b600181815b80851115612bf7578160001904821115612bdd57612bdd6129cc565b80851615612bea57918102915b93841c9390800290612bc1565b509250929050565b600082612c0e575060016122f0565b81612c1b575060006122f0565b8160018114612c315760028114612c3b57612c57565b60019150506122f0565b60ff841115612c4c57612c4c6129cc565b50506001821b6122f0565b5060208310610133831016604e8410600b8410161715612c7a575081810a6122f0565b612c848383612bbc565b8060001904821115612c9857612c986129cc565b029392505050565b6000610e5d8383612bff565b9283526001600160a01b03919091166020830152604082015260600190565b6001600160a01b039384168152919092166020820152604081019190915260600190565b600060208284031215612d0157600080fd5b81518015158114610e5d57600080fd5b808201808211156122f0576122f06129cc565b8082018281126000831280158216821582161715612d4457612d446129cc565b50509291505056fea164736f6c6343000811000a",
  "deployedBytecode": "0x608060405234801561001057600080fd5b50600436106100ba5760003560e01c806303f2cd05146100bf57806313cc55e4146100d457806325817008146100e75780632af7ec8b146100fa5780632dc469a314610127578063434fa7221461013a5780636093c9751461015b57806373c152e91461016e5780637a2a1031146101815780638f86e01514610194578063ba511963146101a7578063bb44afd3146101ba578063ecef4eb9146101cd578063f7f898b0146101e0575b600080fd5b6100d26100cd3660046127b6565b6101f3565b005b6100d26100e23660046127fc565b61026e565b6100d26100f53660046127b6565b6104d7565b61010d610108366004612861565b610844565b604080519283526020830191909152015b60405180910390f35b6100d26101353660046128a2565b6109c0565b61014d610148366004612861565b610bbc565b60405190815260200161011e565b6100d26101693660046127b6565b610e64565b61014d61017c3660046128fd565b610f03565b61014d61018f366004612861565b610f2e565b6100d26101a23660046127b6565b611129565b6100d26101b53660046128fd565b6112b3565b61014d6101c8366004612861565b61157c565b6100d26101db3660046127fc565b6116c7565b6100d26101ee366004612861565b611973565b6102088483306102038786611c77565b611cfc565b60405163ef693bed60e01b81526001600160a01b0384169063ef693bed90610236903390859060040161297d565b600060405180830381600087803b15801561025057600080fd5b505af1158015610264573d6000803e3d6000fd5b5050505050505050565b60405163434efcbd60e01b8152600481018490526000906001600160a01b0388169063434efcbd90602401602060405180830381865afa1580156102b6573d6000803e3d6000fd5b505050506040513d601f19601f820116820180604052508101906102da9190612996565b6040516348c5be7f60e11b8152600481018690529091506000906001600160a01b0389169063918b7cfe90602401602060405180830381865afa158015610325573d6000803e3d6000fd5b505050506040513d601f19601f8201168201806040525081019061034991906129b3565b90506000886001600160a01b03166367aea3136040518163ffffffff1660e01b8152600401602060405180830381865afa15801561038b573d6000803e3d6000fd5b505050506040513d601f19601f820116820180604052508101906103af9190612996565b90506103bd82888587611d2c565b60006103c98987611c77565b905061045f8a886103d984611f1a565b6103e2906129e2565b61045a86876001600160a01b031663fabde80c8b6040518263ffffffff1660e01b815260040161041291906129fe565b602060405180830381865afa15801561042f573d6000803e3d6000fd5b505050506040513d601f19601f8201168201806040525081019061045391906129b3565b8a8a611f65565b612093565b61046b8a883084611cfc565b60405163ef693bed60e01b81526001600160a01b038a169063ef693bed906104999033908a9060040161297d565b600060405180830381600087803b1580156104b357600080fd5b505af11580156104c7573d6000803e3d6000fd5b5050505050505050505050505050565b6000846001600160a01b03166367aea3136040518163ffffffff1660e01b8152600401602060405180830381865afa158015610517573d6000803e3d6000fd5b505050506040513d601f19601f8201168201806040525081019061053b9190612996565b60405163434efcbd60e01b8152600481018590529091506000906001600160a01b0387169063434efcbd90602401602060405180830381865afa158015610586573d6000803e3d6000fd5b505050506040513d601f19601f820116820180604052508101906105aa9190612996565b6040516348c5be7f60e11b8152600481018690529091506000906001600160a01b0388169063918b7cfe90602401602060405180830381865afa1580156105f5573d6000803e3d6000fd5b505050506040513d601f19601f8201168201806040525081019061061991906129b3565b60405163040b0d8960e51b8152600481018790529091506000906001600160a01b03891690638161b12090602401602060405180830381865afa158015610664573d6000803e3d6000fd5b505050506040513d601f19601f820116820180604052508101906106889190612996565b90506001600160a01b03811630148061071157506040516302d75da360e51b81526001600160a01b03891690635aebb460906106cc9084908a903090600401612a12565b602060405180830381865afa1580156106e9573d6000803e3d6000fd5b505050506040513d601f19601f8201168201806040525081019061070d91906129b3565b6001145b156107a65761072282888588611d2c565b6107a18887600061045a88896001600160a01b031663fabde80c8a6040518263ffffffff1660e01b815260040161075991906129fe565b602060405180830381865afa158015610776573d6000803e3d6000fd5b505050506040513d601f19601f8201168201806040525081019061079a91906129b3565b8989611f65565b610264565b6107b282883088611d2c565b6001600160a01b0384166399bec3158385308060006107e78b6107e0676765c793fa10079d601b1b8f612a35565b8c8c611f65565b6040518763ffffffff1660e01b815260040161080896959493929190612a4c565b600060405180830381600087803b15801561082257600080fd5b505af1158015610836573d6000803e3d6000fd5b505050505050505050505050565b6000806000610854868686610f2e565b9050600019810361086c5760008092509250506109b8565b6000866001600160a01b03166367aea3136040518163ffffffff1660e01b8152600401602060405180830381865afa1580156108ac573d6000803e3d6000fd5b505050506040513d601f19601f820116820180604052508101906108d09190612996565b60405163434efcbd60e01b8152600481018490529091506000906001600160a01b0389169063434efcbd90602401602060405180830381865afa15801561091b573d6000803e3d6000fd5b505050506040513d601f19601f8201168201806040525081019061093f9190612996565b604051630f50894160e21b81529091506001600160a01b03831690633d422504906109709089908590600401612a81565b6040805180830381865afa15801561098c573d6000803e3d6000fd5b505050506040513d601f19601f820116820180604052508101906109b09190612a98565b945094505050505b935093915050565b6000856001600160a01b03166367aea3136040518163ffffffff1660e01b8152600401602060405180830381865afa158015610a00573d6000803e3d6000fd5b505050506040513d601f19601f82011682018060405250810190610a249190612996565b60405163434efcbd60e01b8152600481018590529091506000906001600160a01b0388169063434efcbd90602401602060405180830381865afa158015610a6f573d6000803e3d6000fd5b505050506040513d601f19601f82011682018060405250810190610a939190612996565b6040516348c5be7f60e11b8152600481018690529091506000906001600160a01b0389169063918b7cfe90602401602060405180830381865afa158015610ade573d6000803e3d6000fd5b505050506040513d601f19601f82011682018060405250810190610b0291906129b3565b90506000836001600160a01b0316633d42250483856040518363ffffffff1660e01b8152600401610b34929190612a81565b6040805180830381865afa158015610b50573d6000803e3d6000fd5b505050506040513d601f19601f82011682018060405250810190610b749190612a98565b915050610b8e828885610b89888889896120ce565b611d2c565b6000610b9a8987611c77565b905061045f8a88610baa84611f1a565b610bb3906129e2565b61045a866129e2565b600080846001600160a01b03166367aea3136040518163ffffffff1660e01b8152600401602060405180830381865afa158015610bfd573d6000803e3d6000fd5b505050506040513d601f19601f82011682018060405250810190610c219190612996565b9050600080610c31878787610844565b91509150600080600080866001600160a01b031663d07900bb8a6040518263ffffffff1660e01b8152600401610c6991815260200190565b61010060405180830381865afa158015610c87573d6000803e3d6000fd5b505050506040513d601f19601f82011682018060405250810190610cab9190612abc565b505050945050935093509350600083610cc48884612291565b610cce9190612b26565b905085811115610e50576000610ce482886122f6565b90506000610db48a6001600160a01b0316632efcc8666040518163ffffffff1660e01b8152600401602060405180830381865afa158015610d29573d6000803e3d6000fd5b505050506040513d601f19601f82011682018060405250810190610d4d91906129b3565b8b6001600160a01b0316638543d5e06040518163ffffffff1660e01b8152600401602060405180830381865afa158015610d8b573d6000803e3d6000fd5b505050506040513d601f19601f82011682018060405250810190610daf91906129b3565b6122f6565b9050610dbf82612343565b811015610dec57610ddb676765c793fa10079d601b1b82612b26565b9a5050505050505050505050610e5d565b6000610dfb86610daf8a612343565b9050610e0f610e0a898561235a565b612343565b811015610e3d57610e2b676765c793fa10079d601b1b82612b26565b9b505050505050505050505050610e5d565b829b505050505050505050505050610e5d565b6000985050505050505050505b9392505050565b6000610e708483611c77565b9050610e908584610e8084611f1a565b610e89906129e2565b6000612093565b610e9c85843084611cfc565b60405163ef693bed60e01b81526001600160a01b0385169063ef693bed90610eca903390869060040161297d565b600060405180830381600087803b158015610ee457600080fd5b505af1158015610ef8573d6000803e3d6000fd5b505050505050505050565b6000610f10898630612375565b9050610f2289898989858989896112b3565b98975050505050505050565b600080846001600160a01b031663b77b80e3856040518263ffffffff1660e01b8152600401610f5d91906129fe565b602060405180830381865afa158015610f7a573d6000803e3d6000fd5b505050506040513d601f19601f82011682018060405250810190610f9e91906129b3565b90506000856001600160a01b031663782c549c866040518263ffffffff1660e01b8152600401610fce91906129fe565b602060405180830381865afa158015610feb573d6000803e3d6000fd5b505050506040513d601f19601f8201168201806040525081019061100f91906129b3565b90508560005b8381101561111a576040516348c5be7f60e11b81526004810184905286906001600160a01b0384169063918b7cfe90602401602060405180830381865afa158015611064573d6000803e3d6000fd5b505050506040513d601f19601f8201168201806040525081019061108891906129b3565b036110995782945050505050610e5d565b604051634064a0cf60e11b8152600481018490526000906001600160a01b038416906380c9419e906024016040805180830381865afa1580156110e0573d6000803e3d6000fd5b505050506040513d601f19601f820116820180604052508101906111049190612a98565b94506111139150829050612b48565b9050611015565b50600019979650505050505050565b6111348330836123f1565b836001600160a01b03166367aea3136040518163ffffffff1660e01b8152600401602060405180830381865afa158015611172573d6000803e3d6000fd5b505050506040513d601f19601f820116820180604052508101906111969190612996565b6001600160a01b03166399bec315856001600160a01b031663918b7cfe856040518263ffffffff1660e01b81526004016111d291815260200190565b602060405180830381865afa1580156111ef573d6000803e3d6000fd5b505050506040513d601f19601f8201168201806040525081019061121391906129b3565b60405163434efcbd60e01b8152600481018690526001600160a01b0388169063434efcbd90602401602060405180830381865afa158015611258573d6000803e3d6000fd5b505050506040513d601f19601f8201168201806040525081019061127c9190612996565b303061129061128b8a89611c77565b611f1a565b60006040518763ffffffff1660e01b815260040161023696959493929190612a4c565b60405163434efcbd60e01b8152600481018590526000906001600160a01b038a169063434efcbd90602401602060405180830381865afa1580156112fb573d6000803e3d6000fd5b505050506040513d601f19601f8201168201806040525081019061131f9190612996565b90506000896001600160a01b03166367aea3136040518163ffffffff1660e01b8152600401602060405180830381865afa158015611361573d6000803e3d6000fd5b505050506040513d601f19601f820116820180604052508101906113859190612996565b6040516348c5be7f60e11b8152600481018890529091506000906001600160a01b038c169063918b7cfe90602401602060405180830381865afa1580156113d0573d6000803e3d6000fd5b505050506040513d601f19601f820116820180604052508101906113f491906129b3565b90506114018984886123f1565b6114208b8861141361128b8d8b611c77565b61045a868f89888d6125fe565b6114348b883061142f89612343565b61276e565b604051636d24dd6d60e11b81526001600160a01b0383169063da49bada906114629030908c90600401612b61565b602060405180830381865afa15801561147f573d6000803e3d6000fd5b505050506040513d601f19601f820116820180604052508101906114a391906129b3565b60000361150957604051631b29a84160e31b81526001600160a01b0383169063d94d4208906114d6908b906004016129fe565b600060405180830381600087803b1580156114f057600080fd5b505af1158015611504573d6000803e3d6000fd5b505050505b6040516309752ae360e31b81526001600160a01b03891690634ba957189061153d9084903390899082908c90600401612b7b565b600060405180830381600087803b15801561155757600080fd5b505af115801561156b573d6000803e3d6000fd5b505050505050505050505050505050565b600080846001600160a01b03166367aea3136040518163ffffffff1660e01b8152600401602060405180830381865afa1580156115bd573d6000803e3d6000fd5b505050506040513d601f19601f820116820180604052508101906115e19190612996565b90506000806115f1878787610844565b91509150600080846001600160a01b031663d07900bb886040518263ffffffff1660e01b815260040161162691815260200190565b61010060405180830381865afa158015611644573d6000803e3d6000fd5b505050506040513d601f19601f820116820180604052508101906116689190612abc565b505050945050509250508060000361168857600095505050505050610e5d565b6000816116958585612291565b61169f9190612b26565b90508085116116af5760006116b9565b6116b985826122f6565b9a9950505050505050505050565b60405163434efcbd60e01b8152600481018490526000906001600160a01b0388169063434efcbd90602401602060405180830381865afa15801561170f573d6000803e3d6000fd5b505050506040513d601f19601f820116820180604052508101906117339190612996565b90506000876001600160a01b03166367aea3136040518163ffffffff1660e01b8152600401602060405180830381865afa158015611775573d6000803e3d6000fd5b505050506040513d601f19601f820116820180604052508101906117999190612996565b6040516348c5be7f60e11b8152600481018790529091506000906001600160a01b038a169063918b7cfe90602401602060405180830381865afa1580156117e4573d6000803e3d6000fd5b505050506040513d601f19601f8201168201806040525081019061180891906129b3565b905061181e8987600061045a868d89888d6125fe565b61182d89873061142f89612343565b604051636d24dd6d60e11b81526001600160a01b0383169063da49bada9061185b9030908b90600401612b61565b602060405180830381865afa158015611878573d6000803e3d6000fd5b505050506040513d601f19601f8201168201806040525081019061189c91906129b3565b60000361190257604051631b29a84160e31b81526001600160a01b0383169063d94d4208906118cf908a906004016129fe565b600060405180830381600087803b1580156118e957600080fd5b505af11580156118fd573d6000803e3d6000fd5b505050505b6040516309752ae360e31b81526001600160a01b03881690634ba95718906119369084903390899082908c90600401612b7b565b600060405180830381600087803b15801561195057600080fd5b505af1158015611964573d6000803e3d6000fd5b50505050505050505050505050565b6000836001600160a01b03166367aea3136040518163ffffffff1660e01b8152600401602060405180830381865afa1580156119b3573d6000803e3d6000fd5b505050506040513d601f19601f820116820180604052508101906119d79190612996565b60405163434efcbd60e01b8152600481018490529091506000906001600160a01b0386169063434efcbd90602401602060405180830381865afa158015611a22573d6000803e3d6000fd5b505050506040513d601f19601f82011682018060405250810190611a469190612996565b6040516348c5be7f60e11b8152600481018590529091506000906001600160a01b0387169063918b7cfe90602401602060405180830381865afa158015611a91573d6000803e3d6000fd5b505050506040513d601f19601f82011682018060405250810190611ab591906129b3565b90506000836001600160a01b0316633d42250483856040518363ffffffff1660e01b8152600401611ae7929190612a81565b6040805180830381865afa158015611b03573d6000803e3d6000fd5b505050506040513d601f19601f82011682018060405250810190611b279190612a98565b60405163040b0d8960e51b815260048101889052909250600091506001600160a01b03891690638161b12090602401602060405180830381865afa158015611b73573d6000803e3d6000fd5b505050506040513d601f19601f82011682018060405250810190611b979190612996565b90506001600160a01b038116301480611c2057506040516302d75da360e51b81526001600160a01b03891690635aebb46090611bdb9084908a903090600401612a12565b602060405180830381865afa158015611bf8573d6000803e3d6000fd5b505050506040513d601f19601f82011682018060405250810190611c1c91906129b3565b6001145b15611c4757611c37838886610b8989898a8a6120ce565b6107a18887600061045a866129e2565b611c59838830610b8989308a8a6120ce565b6001600160a01b0385166399bec3158486308060006107e7896129e2565b6000610e5d82846001600160a01b031663313ce5676040518163ffffffff1660e01b81526004016020604051808303816000875af1158015611cbd573d6000803e3d6000fd5b505050506040513d601f19601f82011682018060405250810190611ce191906129b3565b611cec906012612ba9565b611cf790600a612ca0565b612291565b60405163438ac0d160e11b81526001600160a01b0385169063871581a29061023690869086908690600401612cac565b826001600160a01b031663a7e944556040518163ffffffff1660e01b81526004016020604051808303816000875af1158015611d6c573d6000803e3d6000fd5b505050506040513d601f19601f82011682018060405250810190611d909190612996565b6001600160a01b03166323b872dd3330846040518463ffffffff1660e01b8152600401611dbf93929190612ccb565b6020604051808303816000875af1158015611dde573d6000803e3d6000fd5b505050506040513d601f19601f82011682018060405250810190611e029190612cef565b50826001600160a01b031663a7e944556040518163ffffffff1660e01b81526004016020604051808303816000875af1158015611e43573d6000803e3d6000fd5b505050506040513d601f19601f82011682018060405250810190611e679190612996565b6001600160a01b031663095ea7b384836040518363ffffffff1660e01b8152600401611e9492919061297d565b6020604051808303816000875af1158015611eb3573d6000803e3d6000fd5b505050506040513d601f19601f82011682018060405250810190611ed79190612cef565b506040516319b6fb0160e01b8152600481018590523360248201526001600160a01b038381166044830152606482018390528416906319b6fb0190608401610236565b806000811215611f605760405162461bcd60e51b815260206004820152600c60248201526b696e742d6f766572666c6f7760a01b60448201526064015b60405180910390fd5b919050565b60405163d07900bb60e01b81526004810182905260009081906001600160a01b0387169063d07900bb9060240161010060405180830381865afa158015611fb0573d6000803e3d6000fd5b505050506040513d601f19601f82011682018060405250810190611fd49190612abc565b5050505050509150506000866001600160a01b0316633d42250485876040518363ffffffff1660e01b815260040161200d929190612a81565b6040805180830381865afa158015612029573d6000803e3d6000fd5b505050506040513d601f19601f8201168201806040525081019061204d9190612a98565b915061205e905061128b8388612b26565b92508083111561207f5761207181611f1a565b61207a906129e2565b612088565b612088836129e2565b979650505050505050565b6040516318f0203f60e31b81526004810184905260248101839052604481018290526001600160a01b0385169063c78101f890606401610236565b60405163d07900bb60e01b81526004810182905260009081906001600160a01b0387169063d07900bb9060240161010060405180830381865afa158015612119573d6000803e3d6000fd5b505050506040513d601f19601f8201168201806040525081019061213d9190612abc565b5050505050509150506000866001600160a01b0316633d42250485876040518363ffffffff1660e01b8152600401612176929190612a81565b6040805180830381865afa158015612192573d6000803e3d6000fd5b505050506040513d601f19601f820116820180604052508101906121b69190612a98565b9150506000876001600160a01b031663fabde80c886040518263ffffffff1660e01b81526004016121e791906129fe565b602060405180830381865afa158015612204573d6000803e3d6000fd5b505050506040513d601f19601f8201168201806040525081019061222891906129b3565b9050600061223f6122398486612291565b836122f6565b9050612256676765c793fa10079d601b1b82612b26565b94508061226e86676765c793fa10079d601b1b612291565b106122795784612284565b612284856001612d11565b9998505050505050505050565b60008115806122b5575082826122a78183612a35565b92506122b39083612b26565b145b6122f05760405162461bcd60e51b815260206004820152600c60248201526b6d756c2d6f766572666c6f7760a01b6044820152606401611f57565b92915050565b6000826123038382612ba9565b91508111156122f05760405162461bcd60e51b815260206004820152600c60248201526b7375622d6f766572666c6f7760a01b6044820152606401611f57565b60006122f082676765c793fa10079d601b1b612291565b6000826123678382612d11565b91508110156122f057600080fd5b6040516339855fd160e11b81526000906001600160a01b0385169063730abfa2906123a69086908690600401612a81565b6020604051808303816000875af11580156123c5573d6000803e3d6000fd5b505050506040513d601f19601f820116820180604052508101906123e991906129b3565b949350505050565b826001600160a01b031663d8dfeb456040518163ffffffff1660e01b8152600401602060405180830381865afa15801561242f573d6000803e3d6000fd5b505050506040513d601f19601f820116820180604052508101906124539190612996565b6001600160a01b03166323b872dd3330846040518463ffffffff1660e01b815260040161248293929190612ccb565b6020604051808303816000875af11580156124a1573d6000803e3d6000fd5b505050506040513d601f19601f820116820180604052508101906124c59190612cef565b50826001600160a01b031663d8dfeb456040518163ffffffff1660e01b8152600401602060405180830381865afa158015612504573d6000803e3d6000fd5b505050506040513d601f19601f820116820180604052508101906125289190612996565b6001600160a01b031663095ea7b384836040518363ffffffff1660e01b815260040161255592919061297d565b6020604051808303816000875af1158015612574573d6000803e3d6000fd5b505050506040513d601f19601f820116820180604052508101906125989190612cef565b50604051633b4da69f60e01b81526001600160a01b03841690633b4da69f906125c7908590859060040161297d565b600060405180830381600087803b1580156125e157600080fd5b505af11580156125f5573d6000803e3d6000fd5b50505050505050565b6040516336286ddd60e11b81526004810183905260009081906001600160a01b03871690636c50dbba906024016020604051808303816000875af115801561264a573d6000803e3d6000fd5b505050506040513d601f19601f8201168201806040525081019061266e91906129b3565b90506000876001600160a01b031663fabde80c876040518263ffffffff1660e01b815260040161269e91906129fe565b602060405180830381865afa1580156126bb573d6000803e3d6000fd5b505050506040513d601f19601f820116820180604052508101906126df91906129b3565b90506126f684676765c793fa10079d601b1b612291565b811015612763576127298261271f61271987676765c793fa10079d601b1b612291565b846122f6565b61128b9190612b26565b925061274084676765c793fa10079d601b1b612291565b61274a8484612291565b106127555782612760565b612760836001612d24565b92505b505095945050505050565b60405163660e160760e01b81526001600160a01b0385169063660e16079061023690869086908690600401612cac565b6001600160a01b03811681146127b357600080fd5b50565b600080600080608085870312156127cc57600080fd5b84356127d78161279e565b935060208501356127e78161279e565b93969395505050506040820135916060013590565b60008060008060008060c0878903121561281557600080fd5b86356128208161279e565b955060208701356128308161279e565b945060408701356128408161279e565b959894975094956060810135955060808101359460a0909101359350915050565b60008060006060848603121561287657600080fd5b83356128818161279e565b925060208401356128918161279e565b929592945050506040919091013590565b600080600080600060a086880312156128ba57600080fd5b85356128c58161279e565b945060208601356128d58161279e565b935060408601356128e58161279e565b94979396509394606081013594506080013592915050565b600080600080600080600080610100898b03121561291a57600080fd5b88356129258161279e565b975060208901356129358161279e565b965060408901356129458161279e565b955060608901356129558161279e565b979a969950949760808101359660a0820135965060c0820135955060e0909101359350915050565b6001600160a01b03929092168252602082015260400190565b6000602082840312156129a857600080fd5b8151610e5d8161279e565b6000602082840312156129c557600080fd5b5051919050565b634e487b7160e01b600052601160045260246000fd5b6000600160ff1b82016129f7576129f76129cc565b5060000390565b6001600160a01b0391909116815260200190565b6001600160a01b0393841681526020810192909252909116604082015260600190565b80820281158282048414176122f0576122f06129cc565b9586526001600160a01b039485166020870152928416604086015292166060840152608083019190915260a082015260c00190565b9182526001600160a01b0316602082015260400190565b60008060408385031215612aab57600080fd5b505080516020909101519092909150565b600080600080600080600080610100898b031215612ad957600080fd5b885197506020890151965060408901519550606089015194506080890151935060a0890151925060c0890151612b0e8161279e565b8092505060e089015190509295985092959890939650565b600082612b4357634e487b7160e01b600052601260045260246000fd5b500490565b600060018201612b5a57612b5a6129cc565b5060010190565b6001600160a01b0392831681529116602082015260400190565b9485526001600160a01b03938416602086015260408501929092529091166060830152608082015260a00190565b818103818111156122f0576122f06129cc565b600181815b80851115612bf7578160001904821115612bdd57612bdd6129cc565b80851615612bea57918102915b93841c9390800290612bc1565b509250929050565b600082612c0e575060016122f0565b81612c1b575060006122f0565b8160018114612c315760028114612c3b57612c57565b60019150506122f0565b60ff841115612c4c57612c4c6129cc565b50506001821b6122f0565b5060208310610133831016604e8410600b8410161715612c7a575081810a6122f0565b612c848383612bbc565b8060001904821115612c9857612c986129cc565b029392505050565b6000610e5d8383612bff565b9283526001600160a01b03919091166020830152604082015260600190565b6001600160a01b039384168152919092166020820152604081019190915260600190565b600060208284031215612d0157600080fd5b81518015158114610e5d57600080fd5b808201808211156122f0576122f06129cc565b8082018281126000831280158216821582161715612d4457612d446129cc565b50509291505056fea164736f6c6343000811000a",
  "devdoc": {
    "custom:changes": "Removed functions from MakerDAO’s version (e.g., ETH/GNT support, some Safe management) to reduce deployment size.                 Replaced `vat` with `safeEngine` and updated to StableUnit-specific interfaces.",
    "custom:security": "This contract is stateless and relies on DSProxy for access control. Users must approve token transfers                 to the proxy for operations like locking collateral or repaying debt. The SafeEngine enforces collateralization                 and debt limits. Some functions assume collateral tokens have arbitrary decimals, handled via `convertTo18`.",
    "custom:usage": "- **Deployment**: Deploy as a stateless contract for DSProxy use.   ```solidity   DssProxyActions proxyActions = new DssProxyActions();   ``` - **Lock Collateral**: Deposit collateral into a Safe.   ```solidity   proxyActions.lockTokenCollateral(cdpManager, collateralJoin, cdpId, amount);   ``` - **Generate Debt**: Draw StablePro debt from a Safe.   ```solidity   proxyActions.generateDebt(cdpManager, taxCollector, coinJoin, cdpId, amount, lockupPeriod);   ``` - **Repay Debt**: Repay StablePro debt to a Safe.   ```solidity   proxyActions.repayDebt(cdpManager, coinJoin, cdpId, amount);   ``` - **Combined Operations**: Lock collateral and generate debt in one transaction.   ```solidity   proxyActions.lockTokenCollateralAndGenerateDebt(cdpManager, taxCollector, collateralJoin, coinJoin, cdpId, collateralAmount, debtAmount, lockupPeriod);   ``` - **Query Safe Info**: Retrieve Safe details for UI display.   ```solidity   (uint256 lockedCollateral, uint256 generatedDebt) = proxyActions.getCdpInfo(cdpManager, user, collateralType);   ```",
    "custom:warning": "Functions are intended for DSProxy use; direct calls may be unsafe due to lack of access control.",
    "details": "Provides functions to manage collateralized debt positions (Safes) through a user’s proxy, including      locking/unlocking collateral, generating/repaying debt, and querying Safe information. It interacts with      StableUnit contracts like DssCdpManager, SafeEngine, CollateralJoin, CoinJoin, and TaxCollector. This contract      is designed to be called via a DSProxy, reducing complexity for users, and includes view functions for UI integration.      Some functions were removed from the MakerDAO version to optimize deployment size.",
    "kind": "dev",
    "methods": {
      "exitTokenCollateral(address,address,uint256,uint256)": {
        "details": "Transfers collateral from the Safe to the proxy and withdraws tokens via CollateralJoin.",
        "params": {
          "amt": "Amount of collateral to withdraw [in token’s decimal precision].",
          "cdp": "Unique identifier of the Safe.",
          "collateralJoin": "Address of the CollateralJoin contract.",
          "manager": "Address of the DssCdpManager contract."
        }
      },
      "freeTokenCollateral(address,address,uint256,uint256)": {
        "details": "Reduces the Safe’s collateral balance and withdraws tokens via CollateralJoin.",
        "params": {
          "amt": "Amount of collateral to unlock [in token’s decimal precision].",
          "cdp": "Unique identifier of the Safe.",
          "collateralJoin": "Address of the CollateralJoin contract.",
          "manager": "Address of the DssCdpManager contract."
        }
      },
      "generateDebt(address,address,address,uint256,uint256,uint256)": {
        "details": "Increases Safe debt, transfers StablePro to the proxy, and withdraws tokens via CoinJoin.",
        "params": {
          "cdp": "Unique identifier of the Safe.",
          "coinJoin": "Address of the CoinJoin contract.",
          "lockupPeriod": "Lockup period for the generated StablePro (protocol-specific).",
          "manager": "Address of the DssCdpManager contract.",
          "taxCollector": "Address of the TaxCollector contract.",
          "wad": "Amount of StablePro to generate [wad]."
        }
      },
      "getAvailableToBorrow(address,address,bytes32)": {
        "details": "Determines borrowing capacity based on collateral value, debt limits, and safety price.",
        "params": {
          "collateralType": "Unique identifier for the collateral type.",
          "manager": "Address of the DssCdpManager contract.",
          "user": "Address of the Safe owner."
        },
        "returns": {
          "_0": "Amount of StablePro available to borrow [wad]."
        }
      },
      "getAvailableToWithdraw(address,address,bytes32)": {
        "details": "Determines excess collateral based on the Safe’s collateralization ratio and safety price.",
        "params": {
          "collateralType": "Unique identifier for the collateral type.",
          "manager": "Address of the DssCdpManager contract.",
          "user": "Address of the Safe owner."
        },
        "returns": {
          "_0": "Amount of collateral available to withdraw [wad]."
        }
      },
      "getCdpId(address,address,bytes32)": {
        "details": "Iterates through the user’s Safes in DssCdpManager to find the matching collateral type.",
        "params": {
          "collateralType": "Unique identifier for the collateral type.",
          "manager": "Address of the DssCdpManager contract.",
          "user": "Address of the Safe owner."
        },
        "returns": {
          "_0": "cdpId Unique identifier of the Safe, or type(uint256).max if not found."
        }
      },
      "getCdpInfo(address,address,bytes32)": {
        "details": "Queries SafeEngine for the Safe’s locked collateral and generated debt.",
        "params": {
          "collateralType": "Unique identifier for the collateral type.",
          "manager": "Address of the DssCdpManager contract.",
          "user": "Address of the Safe owner."
        },
        "returns": {
          "_0": "lockedCollateral Amount of locked collateral [wad].",
          "_1": "generatedDebt Amount of generated debt [wad]."
        }
      },
      "lockTokenCollateral(address,address,uint256,uint256)": {
        "details": "Deposits collateral via CollateralJoin and updates the Safe’s collateral balance.",
        "params": {
          "amt": "Amount of collateral to lock [in token’s decimal precision].",
          "cdp": "Unique identifier of the Safe.",
          "collateralJoin": "Address of the CollateralJoin contract.",
          "manager": "Address of the DssCdpManager contract."
        }
      },
      "lockTokenCollateralAndGenerateDebt(address,address,address,address,uint256,uint256,uint256,uint256)": {
        "details": "Combines collateral deposit and debt generation for efficiency.",
        "params": {
          "cdp": "Unique identifier of the Safe.",
          "coinJoin": "Address of the CoinJoin contract.",
          "collateralAmount": "Amount of collateral to lock [in token’s decimal precision].",
          "collateralJoin": "Address of the CollateralJoin contract.",
          "deltaWad": "Amount of StablePro debt to generate [wad].",
          "lockupPeriod": "Lockup period for the generated StablePro (protocol-specific).",
          "manager": "Address of the DssCdpManager contract.",
          "taxCollector": "Address of the TaxCollector contract."
        }
      },
      "openLockTokenCollateralAndGenerateDebt(address,address,address,address,bytes32,uint256,uint256,uint256)": {
        "details": "Combines Safe creation, collateral deposit, and debt generation for efficiency.",
        "params": {
          "amtC": "Amount of collateral to lock [in token’s decimal precision].",
          "coinJoin": "Address of the CoinJoin contract.",
          "collateralJoin": "Address of the CollateralJoin contract.",
          "collateralType": "Unique identifier for the collateral type.",
          "lockupPeriod": "Lockup period for the generated StablePro (protocol-specific).",
          "manager": "Address of the DssCdpManager contract.",
          "taxCollector": "Address of the TaxCollector contract.",
          "wadD": "Amount of StablePro debt to generate [wad]."
        },
        "returns": {
          "cdp": "Unique identifier of the newly created Safe."
        }
      },
      "repayAllDebt(address,address,uint256)": {
        "details": "Deposits the required StablePro via CoinJoin and clears all Safe debt, handling ownership or permissions.",
        "params": {
          "cdp": "Unique identifier of the Safe.",
          "coinJoin": "Address of the CoinJoin contract.",
          "manager": "Address of the DssCdpManager contract."
        }
      },
      "repayAllDebtAndFreeTokenCollateral(address,address,address,uint256,uint256)": {
        "details": "Combines full debt repayment and collateral withdrawal for efficiency.",
        "params": {
          "amtC": "Amount of collateral to unlock [in token’s decimal precision].",
          "cdp": "Unique identifier of the Safe.",
          "coinJoin": "Address of the CoinJoin contract.",
          "collateralJoin": "Address of the CollateralJoin contract.",
          "manager": "Address of the DssCdpManager contract."
        }
      },
      "repayDebt(address,address,uint256,uint256)": {
        "details": "Deposits StablePro via CoinJoin and reduces Safe debt, handling ownership or permissions.",
        "params": {
          "cdp": "Unique identifier of the Safe.",
          "coinJoin": "Address of the CoinJoin contract.",
          "manager": "Address of the DssCdpManager contract.",
          "wad": "Amount of StablePro to repay [wad]."
        }
      },
      "repayDebtAndFreeTokenCollateral(address,address,address,uint256,uint256,uint256)": {
        "details": "Combines debt repayment and collateral withdrawal for efficiency.",
        "params": {
          "amtC": "Amount of collateral to unlock [in token’s decimal precision].",
          "cdp": "Unique identifier of the Safe.",
          "coinJoin": "Address of the CoinJoin contract.",
          "collateralJoin": "Address of the CollateralJoin contract.",
          "manager": "Address of the DssCdpManager contract.",
          "wadD": "Amount of StablePro to repay [wad]."
        }
      }
    },
    "title": "DssProxyActions",
    "version": 1
  },
  "userdoc": {
    "kind": "user",
    "methods": {
      "exitTokenCollateral(address,address,uint256,uint256)": {
        "notice": "Withdraws collateral from a Safe to the caller."
      },
      "freeTokenCollateral(address,address,uint256,uint256)": {
        "notice": "Unlocks collateral from a Safe and withdraws it to the caller."
      },
      "generateDebt(address,address,address,uint256,uint256,uint256)": {
        "notice": "Generates StablePro debt from a Safe."
      },
      "getAvailableToBorrow(address,address,bytes32)": {
        "notice": "Calculates the amount of StablePro a user can borrow from a Safe."
      },
      "getAvailableToWithdraw(address,address,bytes32)": {
        "notice": "Calculates the amount of collateral a user can withdraw from a Safe."
      },
      "getCdpId(address,address,bytes32)": {
        "notice": "Retrieves the Safe ID for a user’s Safe with a specific collateral type."
      },
      "getCdpInfo(address,address,bytes32)": {
        "notice": "Retrieves collateral and debt information for a user’s Safe."
      },
      "lockTokenCollateral(address,address,uint256,uint256)": {
        "notice": "Locks collateral into a Safe."
      },
      "lockTokenCollateralAndGenerateDebt(address,address,address,address,uint256,uint256,uint256,uint256)": {
        "notice": "Locks collateral and generates StablePro debt in a single transaction."
      },
      "openLockTokenCollateralAndGenerateDebt(address,address,address,address,bytes32,uint256,uint256,uint256)": {
        "notice": "Opens a Safe, locks collateral, and generates StablePro debt in a single transaction."
      },
      "repayAllDebt(address,address,uint256)": {
        "notice": "Repays all StablePro debt for a Safe."
      },
      "repayAllDebtAndFreeTokenCollateral(address,address,address,uint256,uint256)": {
        "notice": "Repays all StablePro debt and unlocks collateral from a Safe in a single transaction."
      },
      "repayDebt(address,address,uint256,uint256)": {
        "notice": "Repays StablePro debt to a Safe."
      },
      "repayDebtAndFreeTokenCollateral(address,address,address,uint256,uint256,uint256)": {
        "notice": "Repays StablePro debt and unlocks collateral from a Safe in a single transaction."
      }
    },
    "notice": "Proxy actions contract for user interaction with the StableUnit protocol via a DSProxy.",
    "version": 1
  },
  "storageLayout": {
    "storage": [],
    "types": null
  }
}